ecogeo:0060,MODIS,,,"""MODIS (or Moderate Resolution Imaging Spectroradiometer) is a key instrument aboard the Terra (EOS AM) and Aqua (EOS PM) satellites. Terra's orbit around the Earth is timed so that it passes from north to south across the equator in the morning, while Aqua passes south to north over the equator in the afternoon. Terra MODIS and Aqua MODIS are viewing the entire Earth's surface every 1 to 2 days, acquiring data in 36 spectral bands, or groups of wavelengths (see MODIS Technical Specifications). These data will improve our understanding of global dynamics and processes occurring on the land, in the oceans, and in the lower atmosphere. MODIS is playing a vital role in the development of validated, global, interactive Earth system models able to predict global change accurately enough to assist policy makers in making sound decisions concerning the protection of our environment.""",http://modis.gsfc.nasa.gov/,,,,,,,,MODIS,Dataset.png
ecogeo:0061,Neuinfo.org,,,"""The Neuroscience Information Framework is a dynamic inventory of Web-based neuroscience resources: data, materials, and tools accessible via any computer connected to the Internet. An initiative of the NIH Blueprint for Neuroscience Research, NIF advances neuroscience research by enabling discovery and access to public research data and tools worldwide through an open source, networked environment.""",http://neuinfo.org/,,,,,,,,Neuinfo.org,Collection_catalog_portal_webpage.png
ecogeo:0062,Ribosomal Database Project (RDP),,,"""RDP provides quality-controlled, aligned and annotated Bacterial and Archaeal 16S rRNA sequences, and Fungal 28S rRNA sequences, and a suite of analysis tools to the scientific community.""",http://rdp.cme.msu.edu/,,,,,,,,Ribosomal Database Project (RDP),globe.jpg
ecogeo:0063,SeaWiFS,,,"""The purpose of the Sea-viewing Wide Field-of-view Sensor (SeaWiFS) Project is to provide quantitative data on global ocean bio-optical properties to the Earth science community.""",http://oceancolor.gsfc.nasa.gov/SeaWiFS/,,,,,,,,SeaWiFS,Dataset.png
ecogeo:0064,SEED,,,"""Curation of genomic data (annotation) is done via the curation of subsystems by an expert annotator across many genomes, not on a gene by gene basis.""",http://www.theseed.org/wiki/Main_Page,,,,,,,,SEED,Collection_catalog_portal_webpage.png
ecogeo:0065,SILVA,,,"""A comprehensive on-line resource for quality checked and aligned ribosomal RNA sequence data. SILVA provides comprehensive, quality checked and regularly updated datasets of aligned small (16S/18S, SSU) and large subunit (23S/28S, LSU) ribosomal RNA (rRNA) sequences for all three domains of life (Bacteria, Archaea and Eukarya).""",http://www.arb-silva.de/,,,,,,,,SILVA,Collection_catalog_portal_webpage.png
ecogeo:0066,UniProt Consortium,,,"""The mission of UniProt is to provide the scientific community with a comprehensive, high-quality and freely accessible resource of protein sequence and functional information.""",http://www.uniprot.org/,,,,,,,,UniProt Consortium,organization.png
ecogeo:0067,World Ocean Atlas,,,"""World Ocean Database 2013 (WOD13) is an update of World Ocean Database 2009 (WOD09). All data are available online presorted by 10 ° geographic squares, by year or by user specified criteria.""",http://www.nodc.noaa.gov/OC5/WOA09/pr_woa09.html,,,,,,,,World Ocean Atlas,project.png