Component Name#info,System,URL#link,Component Description#info,Source,Component Type#multi,Function#multi,Maturity/status,Domain Community#multi,Steward Organization,References-Text#info,Protocols#multi,InterchangeFormats#multi,InputFileFormat#multi,Input parameters#multi,Output file format#multi,InformationModels#multi,Implementation#multi,TimeToLive#info,#name,#img,#href
International Transfer Format for Botanic Garden Plant Records,,http://www.tdwg.org/standards/102/,"International Transfer Format for Botanic Garden Plant Records, version 2 (ITF2) was developed in response to requests from Botanic Gardens to incorporate additional data fields for transfer within the Botanic Gardens and allow for a more flexible transfer format than the original transfer format outlined in ITF version 01.00. It is biased towards 'Conservation Type Data Fields', but incorporates a procedure allowing for additional data fields to be identified and exchanged between gardens. It is because of this flexibility that it is believed that the ITF2 will remain relevant to Botanic Gardens for a long time despite the rapid change in information system technology in recent years.BGCI was helped by international editorial committee, ran a number of International Workshops within the Botanic Garden Community and also consulted with internationally known horticultural Groups over the last 5 years produce this final draft of the International Transfer Format for Botanic Garden Records - Version 2 and it is hoped that others beyond the Botanic Garden Community will be able to make use of this publication.ITF2 was developed in close conjunction with HISPID3 (Herbarium Information Standards and Protocols for the Interchange of Data Version 3) and its progress has been closely monitored by the Centers of Plant Conservation (CPC) based in St Louis, Missouri, North American which is currently developing an data exchange format based on ITF2 but requiring additional fields unique to their network. It is fully compatible with ITF1 and has based its plantname structure on Plant Names in Botanical Databases, Frank A Bisby, Plant Taxonomic Database Standard No. 3 - Version 1.00, December 1994.",High level inventory Pivot Viewer,Specification,TDWG,Conceptual,Biology,,,,,,,,,,,International Transfer Format for Botanic Garden Plant Records,globe.jpg,http://www.tdwg.org/standards/102/
Interpolated Sea Level Pressure - NOTHI,,http://www.pfeg.noaa.gov/products/las/docs/wind_from_pressure.nc.html,"Ontology created by Fleet Numerical Meteorology and Oceanography Center (FNMOC) (NOAA). Vocabulary for the monthly averages of the FNMOC (Fleet Numerical Meteorology and Oceanography Center) 6-hourly analyzed pressure fields interpolated where necessary to a 360 by 181 global spherical grid (1-degree), and Air/Ocean indices computed from the interpolated pressure.",NotDocumented,Dataset,,Published Standard,Ocean Science,NOAA,,,,,,,,,,Interpolated Sea Level Pressure - NOTHI,package-x-generic.png,http://www.pfeg.noaa.gov/products/las/docs/wind_from_pressure.nc.html
IOOS Biological Terms,,http://mmisw.org/orr/#http://mmisw.org/ont/ioos/biological,This is a vocabulary of biological/ecological terms intended to be used by the IOOS observing community. The list will expand with the need for additional terms.,NotDocumented,Vocabulary,information exchange,Unknown,BiologicalSpeciesEcology,NOAA IOOS,,,,,,,,,,IOOS Biological Terms,vocabulary.jpg,http://mmisw.org/orr/#http://mmisw.org/ont/ioos/biological
IOOS Category Vocabulary,,http://mmisw.org/orr/#http://mmisw.org/ont/ioos/category,Categories within IOOS. Additional Categories (not listed in IOOS Core Variables Table 3-3).,NotDocumented,Vocabulary,information exchange,Published Standard,Ocean Science,NOAA IOOS,,,,,,,,,,IOOS Category Vocabulary,vocabulary.jpg,http://mmisw.org/orr/#http://mmisw.org/ont/ioos/category
IOOS Controlled Vocabularies Documentation,,https://code.google.com/p/ioostech/wiki/ControlledVocabularies,"Controlled vocabularies clarify the meaning of common concepts and enable more interoperable data systems through more precise definitions and machine readable online references. This document describes the policies and relevant controlled vocabularies that have been adopted or developed by the IOOS community, including context and specific instructions for use and implementation in data services. They primarily target SOS service requests, but are of general applicability in other services and IOOS DMAC areas as well. The content is intended primarily to serve consumers and providers, including software developers and data managers.(https://code.google.com/p/ioostech/wiki/ControlledVocabularies)",NotDocumented,Web site,information source,Unknown,Oceanography,NOAA IOOS,,,,,,,,,,IOOS Controlled Vocabularies Documentation,globe.jpg,https://code.google.com/p/ioostech/wiki/ControlledVocabularies
IOOS Core Variable Vocabulary,,http://mmisw.org/orr/#http://mmisw.org/ont/ioos/core_variable,"Core variables terms for use in Oceanography data. IOOS Core Variables in Table 3-3, in U.S. Integrated Ocean Observing System: A Blueprint for Full Capability Ver 1.0 (Source: MMI)",NotDocumented,Vocabulary,information exchange,Published Standard,Ocean Science,NOAA IOOS,,,,,,,,,,IOOS Core Variable Vocabulary,vocabulary.jpg,http://mmisw.org/orr/#http://mmisw.org/ont/ioos/core_variable
IOOS Organization Societal Sector,,http://mmisw.org/orr/#http://mmisw.org/ont/ioos/sector,"Terms for describing organizations. IOOS Organization Societal Sector. This vocabulary does not distinguish non-US organizations as such, and should be applicable within their national contexts; for example, a Canadian provincial agency can be described as ""gov_state"".",NotDocumented,Vocabulary,information exchange,Published Standard,Generic,NOAA IOOS,,,,,,,,,,IOOS Organization Societal Sector,vocabulary.jpg,http://mmisw.org/orr/#http://mmisw.org/ont/ioos/sector
IOOS Partner Organizations,,http://mmisw.org/orr/#http://mmisw.org/ont/ioos/organization,List of organizations NOAA is partnered with. IOOS Partner Organizations,NotDocumented,Vocabulary,information exchange,Published Standard,Generic,NOAA IOOS,,,,,,,,,,IOOS Partner Organizations,vocabulary.jpg,http://mmisw.org/orr/#http://mmisw.org/ont/ioos/organization
IOOS Platform Vocabulary,,http://mmisw.org/orr/#http://mmisw.org/ont/ioos/platform,vocabulary of platform types,NotDocumented,Vocabulary,information exchange,Published Standard,Ocean Science,NOAA IOOS,,,,,,,,,,IOOS Platform Vocabulary,vocabulary.jpg,http://mmisw.org/orr/#http://mmisw.org/ont/ioos/platform
IOOS Societal Benefit Areas,,http://mmisw.org/orr/#http://mmisw.org/ont/ioos/societal_areas,"Terms for classifying societal benefits. IOOS Societal Benefit Areas in Table 3-3, in U.S. Integrated Ocean Observing System: A Blueprint for Full Capability Ver 1.0 (Nov 2010). http://www.ioos.gov/library/us_ioos_blueprint_ver1.pdf. Accessed July 31, 2012.",NotDocumented,Vocabulary,information exchange,Published Standard,Human Dimensions,NOAA IOOS,,,,,,,,,,IOOS Societal Benefit Areas,vocabulary.jpg,http://mmisw.org/orr/#http://mmisw.org/ont/ioos/societal_areas
IOOS Vocabulary and Category Definitions,,http://mmisw.org/orr/#http://mmisw.org/ont/ioos/definition,Terms for usage in IOOS Vocabularies and Categories.,NotDocumented,Vocabulary,information exchange,Published Standard,Generic,NOAA IOOS,,,,,,,,,,IOOS Vocabulary and Category Definitions,vocabulary.jpg,http://mmisw.org/orr/#http://mmisw.org/ont/ioos/definition
IOOS vocabulary for definition of SOS SWE element types,,http://mmisw.org/orr/#http://mmisw.org/ont/ioos/swe_element_type,"Vocabulary for SWE Element types. Vocabulary of terms reflecting specific IOOS conventions for use in standard SOS SWE elements. For instance, what to expect in a given SWE dataRecord based on the elements definition. The links in the reference attribute give examples where the term is used in the IOOS SOS Milestone 1.0 templates (note that line numbers may be approximate).",NotDocumented,Vocabulary,information exchange,Published Standard,Ocean Science,NOAA IOOS,,,,,,,,,,IOOS vocabulary for definition of SOS SWE element types,vocabulary.jpg,http://mmisw.org/orr/#http://mmisw.org/ont/ioos/swe_element_type
IOOS Vocabulary Version 1,,http://mmisw.org/orr/#http://mmisw.org/ont/ioos/identifier_parameter_program,"IOOS Vocabulary Version 1 from the ""Guide for IOOS Data Providers Version 1.0, June 2, 2006"". This vocabulary is currently under consideration as an official standard for the IOOS Data Management and Communications (DMAC) Steering Team.",NotDocumented,Vocabulary,information exchange,Published Standard,Ocean Science,NOAA IOOS,,,,,,,,,,IOOS Vocabulary Version 1,vocabulary.jpg,http://mmisw.org/orr/#http://mmisw.org/ont/ioos/identifier_parameter_program
iPython Notebook,Ocean Observatory Initiative (OOI),http://ipython.org/notebook,"The IPython Notebook is a web-based interactive computational environment where you can combine code execution, text, mathematics, plots and rich media into a single document",Original CIComponent Compilation,Execution environment,computation,Operational,Generic,,,,,,,,,,,iPython Notebook,globe.jpg,http://ipython.org/notebook
IRD QA/QC Flags,,http://mmisw.org/orr/#http://mmisw.org/ont/ird/qualityFlag,QA/QC Flags used by IRD,NotDocumented,Vocabulary,information exchange,Published Standard,Ocean Science,Institut de Recherche pour le Developpement,,,,,,,,,,IRD QA/QC Flags,vocabulary.jpg,http://mmisw.org/orr/#http://mmisw.org/ont/ird/qualityFlag
IRIS Web Services,IRIS,http://service.iris.edu,Services for accessing IRIS data system,IlyaZaslavsky,Repository,Data access,Operational,Seismology,IRIS,,HTTP API,CSV,,,"CSV, miniSEED, ASCII, XML, png",not explicit,,,IRIS Web Services,database.jpg,service.iris.edu
iRODS,World Wide Web (WWW),,"Data management system, rule-based repository. iRODS, the Integrated Rule-Oriented Data System, is a data grid software system developed by the Data Intensive Cyber Environments research group (developers of the SRB, the Storage Resource Broker), and collaborators. iRODS management policies (sets of assertions these communities make about their digital collections) are characterized in iRODS Rules and state information. At the iRODS core, a Rule Engine interprets the Rules to decide how the system is to respond to various requests and conditions. iRODS is open source under a BSD license. Distributed storage access layer and file system. Requires file or database based storage resources.",Original CIComponent Compilation,Server application,"data management, data access",,,,,,,,,,,,,iRODS,webclient.jpg,
ISDM Data Type COdes,,http://www.meds-sdmm.dfo-mpo.gc.ca/isdm-gdsi/code/list/005-eng.asp,"A list of 2-character codes to describe the instrumentation origins of the data, from Integrated Science Data Management, Fisheries and Oceans Canada.",NotDocumented,Vocabulary,information exchange,Published Standard,BiologicalSpeciesEcology,Integrated Science Data Management,,,,,,,,,,ISDM Data Type COdes,vocabulary.jpg,http://www.meds-sdmm.dfo-mpo.gc.ca/isdm-gdsi/code/list/005-eng.asp
ISDM Q Value Codes,,http://www.meds-sdmm.dfo-mpo.gc.ca/isdm-gdsi/code/list/014-eng.asp,"These are the quality flags used to describe the validity of a measurement, code list from Integrated Science Data Management, Fisheries and Oceans Canada",NotDocumented,Vocabulary,information exchange,Published Standard,BiologicalSpeciesEcology,Integrated Science Data Management,,,,,,,,,,ISDM Q Value Codes,vocabulary.jpg,http://www.meds-sdmm.dfo-mpo.gc.ca/isdm-gdsi/code/list/014-eng.asp
ISO 19115 North American Profile,,http://www.fgdc.gov/standards/projects/incits-l1-standards-projects/NAP-Metadata,"Profile of ISO19115(2006) with XML encoding per ISO19139, for geospatial Metadata for datasets and services",High level inventory Pivot Viewer,Specification,DCC,Conceptual,Earth Surface,Digital Curation Center,,,,,,,,,,ISO 19115 North American Profile,globe.jpg,http://www.fgdc.gov/standards/projects/incits-l1-standards-projects/NAP-Metadata
ISO 19115-2 - Imagery and gridded data,,http://www.iso.org/iso/catalogue_detail.htm?csnumber=39229,Extenstions to ISO19115(2006) for metadata describing gridded data and imagery,High level inventory Pivot Viewer,Specification,DCC,Conceptual,Earth Surface,International Organization for Standardization,,,,,,,,,,ISO 19115-2 - Imagery and gridded data,globe.jpg,http://www.iso.org/iso/catalogue_detail.htm?csnumber=39229
ITAPS Mesh,MOAB,http://www.itaps.org/,"Many applications need advanced software tools to manage the complexities associated with sophisticated geometry, mesh, and field manipulation tasks, particularly as computer architectures move toward the petascale. The Center for Interoperable Technologies for Advanced Petascale Simulations (ITAPS) will deliver interoperable and interchangeable mesh, geometry, and field manipulation services that are of direct use to scientific applications.",Original CIComponent Compilation,Web application framework,computation,Operational,,Lawrence Livermore National Labs,,,,,,,,,,ITAPS Mesh,globe.jpg,http://www.itaps.org/
java4Inspire,,https://joinup.ec.europa.eu/software/java4inspire/description,Java4inspire is a java library to handle INSPIRE data as java objects.,High level inventory Pivot Viewer,Software library,,Conceptual,,,,,,,,,,,,java4Inspire,software.png,https://joinup.ec.europa.eu/software/java4inspire/description
Kentucky Geoportal,World Wide Web (WWW),http://kygisserver.ky.gov/geoportal/catalog/main/home.page,Metadata catalog with a bunch of geology resources,Original CIComponent Compilation,Catalog,Discovery,Operational,,state of Kentucky,,,,,,,,,,Kentucky Geoportal,icon_catalog.jpg,http://kygisserver.ky.gov/geoportal/catalog/main/home.page
Kepler,Ocean Observatory Initiative (OOI),http://kepler-project.org/,"Kepler is a workflow engine. Kepler is designed to help scienÃ‚Â­tists, analysts, and computer programmers create, execute, and share models and analyses across a broad range of scientific and engineering disciplines. Kepler can operate on data stored in a variety of formats, locally and over the internet, and is an effective environment for integrating disparate software components, such as merging ""R"" scripts with compiled ""C"" code, or facilitating remote, distributed execution of models. Using Kepler's graphical user interface, users simply select and then connect pertinent analytical components and data sources to create a ""scientific workflow""Ã¢â‚¬â€?an executable representation of the steps required to generate results. The Kepler software helps users share and reuse data, workflows, and compoÃ‚Â­nents developed by the scientific community to address common needs.",Original CIComponent Compilation,Execution environment,workflow management,Operational,,,,,,,,,,,,Kepler,globe.jpg,http://kepler-project.org/
Key to TDWG Standards Status and Categories,,http://www.tdwg.org/standards/status-and-categories/,Key to understanding how TDWG classifies their standards and the categories applied to their information networks and projects.,NotDocumented,Vocabulary,information exchange,Community-Established,BiologicalSpeciesEcology,TDWG Taxonomic Databases Working Group for biodiversity,,,,,,,,,,Key to TDWG Standards Status and Categories,vocabulary.jpg,http://www.tdwg.org/standards/status-and-categories/
Keyhole Markup Language (KML),,http://www.opengeospatial.org/standards/kml,"language for expressing geographic annotation and visualization on existing or future web-based online and mobile maps (2d) and earth browsers (3d). KML is an XML language focused on geographic visualization, including annotation of maps and images. Geographic visualization includes not only the presentation of graphical data on the globe, but also the control of the user's navigation in the sense of where to go and where to look. KML is complementary to most of the key existing OGC standards including GML (Geography Markup Language), WFS (Web Feature Service) and WMS (Web Map Service). Currently, KML 2.2 utilizes certain geometry elements derived from GML 2.1.2. These elements include point, line string, linear ring, and polygon.",NotDocumented,Interchange Format,,Published Standard,Geospatial,Open Geospatial Consortium,,,,,,,,,,Keyhole Markup Language (KML),globe.jpg,http://www.opengeospatial.org/standards/kml
Keywords - (GCMD) Global Change Master Directory,,http://gcmd.nasa.gov/Resources/valids/archives/keyword_list.html,Global Change Master Directory (http://gcmd.nasa.gov) controlled keywords. links to CVS files containing vocabularies,NotDocumented,Vocabulary,information exchange,AdHoc,Atmosphere,NASA,,,,,,,,,,Keywords - (GCMD) Global Change Master Directory,vocabulary.jpg,http://gcmd.nasa.gov/Resources/valids/archives/keyword_list.html
Kombu,Ocean Observatory Initiative (OOI),http://ask.github.com/kombu/,"The aim of Kombu is to make messaging in Python as easy as possible by providing an idiomatic high-level interface for the AMQP protocol, and also provide proven and tested solutions to common messaging problems.",Original CIComponent Compilation,Software library,machine interface,Operational,,,, AMQP protocol,,,,,,,,Kombu,software.png,http://ask.github.com/kombu/
KomFor Data Portal,,http://www.komfor.net/data-portal.html,KOMFOR provides access to data in the earth and environmental sciences with special emphasis on geological disciplines The minimum set of metadata elements in KomFor is determined by the DataCite metadata schema.,NotDocumented,Catalog,,,Various,Digital Curation Centre,,,,,,,,,,KomFor Data Portal,icon_catalog.jpg,http://www.komfor.net/data-portal.html
KVM,Ocean Observatory Initiative (OOI),http://www.linux-kvm.org/page/Main_Page,KVM (for Kernel-based Virtual Machine) is a full virtualization solution for Linux on x86 hardware containing virtualization extensions (Intel VT or AMD-V).,Original CIComponent Compilation,Desktop application,virtual machine deployment,Operational,,,,,,,,,,,,KVM,package-x-generic.png,http://www.linux-kvm.org/page/Main_Page
LAADS Web,Level 1 and Atmosphere Archive and Distribution System (LAADS),http://ladsweb.nascom.nasa.gov/index.html,"web interface to the Level 1 and Atmosphere Archive and Distribution System (LAADS). The mission of LAADS is to provide quick and easy access to MODIS Level 1, Atmosphere and Land data products and VIIRS Level 1 and Land data products. Search, order, and download MODIS Level 1, Atmosphere and Land data products and VIIRS Level 1 and Land data products. Products may also be subset by parameter, area, or band, mosaiced, reprojected, or masked. Visually browse MODIS Level 1, Atmosphere and Land data products. Access tools to use with MODIS Level 1, Atmosphere and Land data products and VIIRS Level 1 and Land data products.",Original CIComponent Compilation,Web site,Data access,Operational,,Goddard Space flight center  NASA,,,,,,,,,,LAADS Web,globe.jpg,http://ladsweb.nascom.nasa.gov/index.html
Language Vocabulary,,http://www.rvdata.us/voc/language,IDs and names of various languages.,NotDocumented,Vocabulary,information exchange,Unknown,Ocean Science,Rolling Deck to Repository (R2R),,,,,,,,,,Language Vocabulary,vocabulary.jpg,http://www.rvdata.us/voc/language
LDAP,Server OS *nix,http://tools.ietf.org/html/rfc4510,"The Lightweight Directory Access Protocol (LDAP) is an open, vendor-neutral directory service protocol to provide a mechanism used to connect to, search, and modify Internet directories. The LDAP directory service is based on a client-server model, and runs on a layer above the TCP/IP stack.",Original CIComponent Compilation,Specification,information exchange,Operational,,Fedora,,,,,,,,,,LDAP,globe.jpg,http://tools.ietf.org/html/rfc4510
Lexical Markup Framework Ontology version 14,,http://vocab.deri.ie/lmf,Specification of Lexical Markup Framework (ISO 24613 rev 14),NotDocumented,Vocabulary,information exchange,Unknown,Data Systems,Digital Enterprise Research Institute,,,,,,,,,,Lexical Markup Framework Ontology version 14,vocabulary.jpg,http://vocab.deri.ie/lmf
LEXINFO Vocabulary,,http://lov.okfn.org/dataset/lov/vocabs/lexinfo,"LexInfo builds on the lemon model to represent lexical information attached to ontologies on the semantic web. LexInfo has been developed at CITEC, DERI and DFKI and UPM.",NotDocumented,Vocabulary,information exchange,Unknown,Data Systems,Digital Enterprise Research Institute,,,,,,,,,,LEXINFO Vocabulary,vocabulary.jpg,http://vocab.deri.ie/lexinfo
libcloud,Ocean Observatory Initiative (OOI),http://incubator.apache.org/libcloud/,libcloud is a python client for the AWS Query API. It is compatible with EC2 and Nimbus.,Original CIComponent Compilation,Software library,virtual machine deployment,Operational,,,,,,,,,,,,libcloud,software.png,http://incubator.apache.org/libcloud/
libvirt,Ocean Observatory Initiative (OOI),http://libvirt.org/,Libvirt is * A toolkit to interact with the virtualization capabilities of recent versions of Linux (and other OSes). * Free software available under the GNU Lesser General Public License. * A long term stable C API * A set of bindings for common languages * A CIM provider for the DMTF virtualization schema * A QMF agent for the AMQP/QPid messaging system,Original CIComponent Compilation,Software library,virtual machine deployment,Operational,,,,,,,,,,,,libvirt,software.png,
LION,Fixed point Open Ocean Observatory network (FixO3),http://www.fixo3.eu/observatory/lion/,Deep-sea mooring located in the convection cell in the centre of the Gulf of Lion which aims to observe the winter convection affecting the north-western Mediterranean Sea water circulation and deep-sea ecosystem (physical data). The mooring is deployed near the ODAS meteorological surface buoy (Gulf of Lion) and integrated in the MOOSE network.,NotDocumented,Platform,,Operational,Ocean Science,Fixed-point Open Ocean Observatories,,,,,,,,,,LION,globe.jpg,http://www.fixo3.eu/observatory/lion/
List of agricultural products - NOTHI,,http://eur-lex.europa.eu/LexUriServ/LexUriServ.do?uri=CELEX:12012E/TXT:EN:NOT,"Products listed in Annex I of the Treaty, products falling under CN codes 4502, 4503 and 4504 (cork products), processed agricultural products where the product resulting from the operation remains such a product and products intended to imitate or substitute milk and milk products, excluding those products covered by Council Regulation (EC) 104/2000 of 12 December 1999 on the common organisation of the market in fishery and aquaculture products).",NotDocumented,Vocabulary,information exchange,,Agriculture,Join Up -- European Union Interoperability Solutions for Public Administrations (ISA) Programme.,,,,,,,,,,List of agricultural products - NOTHI,vocabulary.jpg,http://eur-lex.europa.eu/LexUriServ/LexUriServ.do?uri=CELEX:12012E/TXT:EN:NOT
List of Model Variables and Their Definitions,Advanced Regional Prediction System (ARPS),http://www.caps.ou.edu/ARPS/download/code/pub/ARPS.docs/ARPS4DOC.PDF/arpsapxD.pdf,pdf file containing lists of variables and definitions,High level inventory Pivot Viewer,Vocabulary,information exchange,Unknown,ExtremeEvents,,,,,,,,,,,List of Model Variables and Their Definitions,vocabulary.jpg,http://www.caps.ou.edu/ARPS/download/code/pub/ARPS.docs/ARPS4DOC.PDF/arpsapxD.pdf
Live Access Server,World Wide Web (WWW),http://ferret.pmel.noaa.gov/LAS/;  http://ferret.pmel.noaa.gov/LAS/documentation/introduction/,"The Live Access Server (LAS) is a highly configurable web server designed to provide flexible access to geo-referenced scientific data. It can present distributed data sets as a unified virtual data base through the use of DODS networking. Ferret is the default visualization application used by LAS, though other applications (Matlab, IDL, GrADS, ...) can also be used. LAS is a specialized Web Application framework for displaying and analyzing Earth Science data, but even so it is built using conventional Web application technology. List of instances: http://ferret.pmel.noaa.gov/LAS/las-servers",Original CIComponent Compilation,Server application,Data access,Operational,,"NOAA/OAR/PMEL
Pacific Marine Environmental Laboratory",,OpenDAP,,,,,,"Java, Linux",,Live Access Server,webclient.jpg,http://ferret.pmel.noaa.gov/LAS/;  http://ferret.pmel.noaa.gov/LAS/documentation/introduction/
Location Type Vocabulary,,http://www.rvdata.us/voc/locationtype,Terms to describe the various locations within and on a vessel.,NotDocumented,Vocabulary,information exchange,Unknown,Ocean Science,Rolling Deck to Repository (R2R),,,,,,,,,,Location Type Vocabulary,vocabulary.jpg,http://www.rvdata.us/voc/locationtype
loggly,Ocean Observatory Initiative (OOI),https://www.loggly.com/,"Loggly helps cloud-centric organizationsÃ¢â‚¬â€?organizations that build and manage cloud-facing applicationsÃ¢â‚¬â€?to solve operational problems faster. Our solution analyzes log data from virtually any application, system, or platform to answer your burning questions:",Original CIComponent Compilation,Server application,reporting,Operational,,Loggly,,,,,,,,,,loggly,webclient.jpg,https://www.loggly.com/
