Component Name#info,System,URL#link,Component Description#info,Source,Component Type#multi,Function#multi,Maturity/status,Domain Community#multi,Steward Organization,References-Text#info,Protocols#multi,InterchangeFormats#multi,InputFileFormat#multi,Input parameters#multi,Output file format#multi,InformationModels#multi,Implementation#multi,TimeToLive#info,#name,#img,#href
Oregon Coastal Atlas Draft Erosion Ontology,,http://mmisw.org/orr/#http://www.coastalatlas.net/ont/20080701/theme/theme.owl,Oregon Coastal Atlas ontology focused on Coastal Erosion Hazard related topics for now. Edited down to display terms for existing or potential data. Integrates top ontology developed by USGS. Replaces: http://www.coastalatlas.net/ont/20080618/coastalatlas,NotDocumented,Vocabulary,information exchange,Community-Defacto,Ocean Science,Oregon Coastal Atlas,,,,,,,,,,Oregon Coastal Atlas Draft Erosion Ontology,vocabulary.jpg,http://mmisw.org/orr/#http://www.coastalatlas.net/ont/20080701/theme/theme.owl
Organization Vocabulary,,http://www.rvdata.us/voc/organization,Vocabulary with codes and names of organizations R2R works with.,NotDocumented,Vocabulary,information exchange,Unknown,Ocean Science,Rolling Deck to Repository (R2R),,,,,,,,,,Organization Vocabulary,vocabulary.jpg,http://www.rvdata.us/voc/organization
Organizational Structure Vocabulary,,http://vocab.deri.ie/orgs,(enhance)Organizational Structure Vocabulary,NotDocumented,Vocabulary,information exchange,Unknown,Data Systems,Digital Enterprise Research Institute,,,,,,,,,,Organizational Structure Vocabulary,vocabulary.jpg,http://vocab.deri.ie/orgs
Pangaea,,http://www.pangaea.de/about/,"The information system PANGAEA is operated as an Open Access library aimed at archiving, publishing and distributing georeferenced data from earth system research. The system guarantees long-term availability of its content through a commitment of the operating institutions. Most of the data are freely available and can be used under the terms of the license mentioned on the data set description. A few password protected data sets are under moratorium from ongoing projects. The description of each data set is always visible and includes the principle investigator (PI) who may be asked for access. Each dataset can be identified, shared, published and cited by using a Digital Object Identifier (DOI). Data are archived as supplements to publications or as citable data collections. Citations are available through the portal of the German National Library of Science and Technology (GetInfo).",NotDocumented,System,,Community-Established,Geology,Pangaea,,,,,,,,,,Pangaea,globe.jpg,http://www.pangaea.de/about/
PASTA,LTEr,http://lno.lternet.edu/projects/pasta,"The Provenance Aware Synthesis Tracking Architecture (PASTA) is a developing model for dynamically harvesting and archiving site-based data and metadata of the LTER Network for use in generating synthetically derived data products. These derived data products are then accessed through multiple user and machine interfaces. All derived data are described by a rich and structured Ecological Metadata Language (EML) document, which emphasizes the product processing history and its origin Ã¢â‚¬â€œ the product Ã¢â‚¬Å“provenanceÃ¢â‚¬ï¿½. PASTA is modular by design (see Figure) and can be represented by many software components that fit together within the broader model.",Original CIComponent Compilation,Repository,,,,,,,,,,,,,,PASTA,globe.jpg,http://lno.lternet.edu/projects/pasta
Person Vocabulary,,http://www.rvdata.us/voc/person,Vocabulary with IDs and full names of people associated with R2R.,NotDocumented,Vocabulary,information exchange,Unknown,Ocean Science,Rolling Deck to Repository (R2R),,,,,,,,,,Person Vocabulary,vocabulary.jpg,http://www.rvdata.us/voc/person
"PetDB, the Petrological Database",,http://www.earthchem.org/petdb,"PetDB is a global synthesis of chemical, isotopic, and mineralogical data for rocks, minerals, and melt inclusions. PetDB's current content focuses on data for igneous and metamorphic rocks from the ocean floor, specifically mid-ocean ridge basalts and abyssal peridotites, and xenolith samples from the Earth's mantle and lower crust.",NotDocumented,Database,,Community-Defacto,Geochemistry,Integrated Earth Data Applications,,,,,,,,,,"PetDB, the Petrological Database",database.jpg,http://www.earthchem.org/petdb
Pika Client Library,Ocean Observatory Initiative (OOI),http://pypi.python.org/pypi/pika,Pure Python AMQP broker connectivity,Original CIComponent Compilation,Software library,machine interface,,,,,,,,,,,,,Pika Client Library,software.png,http://pypi.python.org/pypi/pika
PIMMS - Portable Infrastructure for the Metafor Metadata System,,http://www.ceda.ac.uk/projects/pimms/  |  https://github.com/cedadev/pimms,"A methodology and toolset for documenting climatology simulation experiments using the Metafor CIM. PIMMS tools capture metadata about models and simulations and the resoning behind them. PIMMS tools produce metadata in the Metafor Common Information Model (CIM) format. Simple view of the CIM UML that underpins PIMMSThe CIM structure can be configured with different controlled vocabularies just as CIM in the Metafor cartoon can wear different outfits. PIMMS brings together the technologies used by Metafor to create the CMIP5 metadata questionnaire into a single interface that allows users to generate their own bespoke metadata questionnaires. PIMMS tools do this by providing users with a GUI to describe experiments which record why simulations are running / have been run, a tool to upload and translate controlled vocabulary mind maps and a configuration interface to select the experiments and controlled vocabularies that will be used to generate a metadata questionnaire.",High level inventory Pivot Viewer,Software library,DCC,Unknown,Data Systems,Digital Curation Centre,,,,,,,,,,PIMMS - Portable Infrastructure for the Metafor Metadata System,software.png,http://www.ceda.ac.uk/projects/pimms/  |  https://github.com/cedadev/pimms
Plant Names in Botanical Databases,,http://www.tdwg.org/standards/113/,"This standard defines the taxonomic and nomenclatural concepts associated with the names of plants. It describes the component parts, their functions and their interrelations of significance in structuring a database. The appendices provide an outline of a preliminary data dictionary illustrating possible elements and their properties. It does not provide a data model or a data format. A data model will be considered at a later date by the TDWG Sub-group considering this standard. Another TDWG Sub-group is preparing XDF, an EXchange Data Format (Allkin & White,1989; White & Allkin, 1992), which provides a language for defining a range of exchange formats for use between taxonomic databases",High level inventory Pivot Viewer,Specification,TDWG,Conceptual,Biology,Biodiversity Information Standards (TDWG),,,,,,,,,,Plant Names in Botanical Databases,globe.jpg,http://www.tdwg.org/standards/113/
Plant Occurrence and Status Scheme,,http://www.tdwg.org/standards/106/,"The Plant Occurrence and Status Scheme (POSS) has been developed to provide standard terms for recording the occurrence of a plant taxon for a specific location. POSS aims to provide both a clear, unambiguous framework for information management, and at the same time provides a mechanism for information exchange.",High level inventory Pivot Viewer,Specification,TDWG,Conceptual,Biology,Biodiversity Information Standards (TDWG),,,,,,,,,,Plant Occurrence and Status Scheme,globe.jpg,http://www.tdwg.org/standards/106/
PO DAAC HITIDE Subsetter,Physical Oceanography DAAC (PODAAC),http://podaac-tools.jpl.nasa.gov/hitide/,"Online tool for subsetting datasets. The HIgh-level Tool for Interactive Data Extraction (HITIDE) is a web-based interface facilitating the search, imaging, and extraction of select Level 2 ""swath"" datasets from PO.DAAC's archive. HiTIDE's v3.1.x user interface is powered by a set of Web Services which facilitate machine to machine interoperability.",Original CIComponent Compilation,Web site,Data access,Operational,,JPL NASA,,,,,,,,,,PO DAAC HITIDE Subsetter,globe.jpg,http://podaac-tools.jpl.nasa.gov/hitide/
Polar Data Centre (PDC),British Antarctic Survey,http://pdc.nerc.ac.uk/,"Data from polar regions collected and submitted by UK scientists. The Polar Data Centre (PDC) coordinates the management of data collected by UK funded scientists in the polar regions, and replaces the Antarctic Environmental Data Centre (AEDC) from 1st April 2009. The PDC is based within the British Antarctic Survey (BAS) and is part of the Natural Environment Research Council (NERC) network of data centres. It is the UK's National Antarctic Data Centre in the SCAR Standing Committee on Antarctic Data Management (SCADM).",High level inventory Pivot Viewer,Repository,,,Polar Geology,,,,,,,,,,,Polar Data Centre (PDC),database.jpg,http://pdc.nerc.ac.uk/
Polaris,National Snow and Ice Data Center,http://nsidc.org/data/polaris/,"Polaris allows for the search and customization of NSIDC data with immediate downloads. You can use this interface to get file-level, on-the-fly browse access to selected NSIDC data sets and immediate access to the data as it is archived at NSIDC. You can also reformat, reproject, and subset the data on-the-fly, with live downloads available via the data queue as soon as your request is completed.",Original CIComponent Compilation,Web site,Data access,Operational,,"National Snow and Ice Data center, NASA, ",,,,,,,,,,Polaris,globe.jpg,http://nsidc.org/data/polaris/
Porcupine Abyssal Plain Observatory,,http://noc.ac.uk/pap,"The Porcupine Abyssal Plain (PAP) Observatory is a sustained, multidisciplinary observatory in the North Atlantic coordinated by the National Oceanography Centre, Southampton. For over 20 years the observatory has provided key time-series datasets for analysing the effect of climate change on the open ocean and deep-sea ecosystems.",NotDocumented,Platform,,Not Evaluated,Oceanography,Fixed-point Open Ocean Observatories,,,,,,,,,,Porcupine Abyssal Plain Observatory,globe.jpg,http://noc.ac.uk/pap
Port Vocabulary,,http://www.rvdata.us/voc/port,ID numbers and names of ports relevant to the R2R project.,NotDocumented,Vocabulary,information exchange,Unknown,Ocean Science,Rolling Deck to Repository (R2R),,,,,,,,,,Port Vocabulary,vocabulary.jpg,http://www.rvdata.us/voc/port
portrayal servers,GEOSS,,"Produces visual pictures from geographic data, e.g., Web Map Service (WMS), Coverage Portrayal Services (CPS) and Feature Portrayal Services (FPS).",Original CIComponent Compilation,Server application,data presentation,Conceptual,,GEOSS,OGC AIP-7 Architecture report,WMS | WFS | WCS,,,,,,,,portrayal servers,webclient.jpg,
POSEIDON E1-M3A,,http://www.poseidon.hcmr.gr/onlinedata.php,"Multidisciplinary mooring located at the eastern Mediterranean off shore Crete island, an area of open sea conditions, characterized as extremely oligotrophic where dense waters with intermediate and deep characteristics are formed.",NotDocumented,Platform,,,Ocean Science,Fixed-point Open Ocean Observatories,,,,,,,,,,POSEIDON E1-M3A,globe.jpg,http://www.poseidon.hcmr.gr/onlinedata.php
PostGIS,Ocean Observatory Initiative (OOI),http://postgis.net/,PostGIS is a spatial database extender for PostgreSQL object-relational database. It adds support for geographic objects allowing location queries to be run in SQL.,Original CIComponent Compilation,Database,data management,Operational,,,,,,,,,,,,PostGIS,database.jpg,
PostgreSQL,Ocean Observatory Initiative (OOI),http://www.postgresql.org/about/,"PostgreSQL is a powerful, open source object-relational database system. It has more than 15 years of active development and a proven architecture that has earned it a strong reputation for reliability, data integrity, and correctness. It runs on all major operating systems, including Linux, UNIX (AIX, BSD, HP-UX, SGI IRIX, Mac OS X, Solaris, Tru64), and Windows. It is fully ACID compliant, has full support for foreign keys, joins, views, triggers, and stored procedures (in multiple languages). It includes most SQL:2008 data types, including INTEGER, NUMERIC, BOOLEAN, CHAR, VARCHAR, DATE, INTERVAL, and TIMESTAMP. It also supports storage of binary large objects, including pictures, sounds, or video. It has native programming interfaces for C/C++, Java, .Net, Perl, Python, Ruby, Tcl, ODBC, among others, and exceptional documentation.",Original CIComponent Compilation,Database,data management,Operational,,,,,,,,,,,,PostgreSQL,database.jpg,
Print Tracking Vocabulary,,,The printTracking ontology could be used to represent data coming from the usual print auditing siftware. One possible use case is to use the data along with data from other data sources in the organization to prepare sustainability reports in the organization.,NotDocumented,Vocabulary,information exchange,Unknown,Data Systems,Digital Enterprise Research Institute,,,,,,,,,,Print Tracking Vocabulary,vocabulary.jpg,http://vocab.deri.ie/printTracking
Privacy Preference Manager Ontology (PPMO),,,An ontology to describe privacy preference manager configuration settings including assigning administration rights,NotDocumented,Vocabulary,information exchange,Unknown,Data Systems,Digital Enterprise Research Institute,,,,,,,,,,Privacy Preference Manager Ontology (PPMO),vocabulary.jpg,http://vocab.deri.ie/ppmo
Privacy Preference Ontology (PPO),,,An ontology to create privacy preferences for Linked Data,NotDocumented,Vocabulary,information exchange,Unknown,Data Systems,Digital Enterprise Research Institute,,,,,,,,,,Privacy Preference Ontology (PPO),vocabulary.jpg,http://vocab.deri.ie/ppo
Process Engine,Ocean observatory initiative (OOI),,,Original CIComponent Compilation,Component,data processing,Conceptual,,,,,,,,,,planned?,,Process Engine,globe.jpg,
Processing Level Vocabulary,,http://www.rvdata.us/voc/processinglevel,Five different levels R2R data can be in and what those levels mean.,NotDocumented,Vocabulary,information exchange,Unknown,Ocean Science,Rolling Deck to Repository (R2R),,,,,,,,,,Processing Level Vocabulary,vocabulary.jpg,http://www.rvdata.us/voc/processinglevel
Processing Levels of NOAA Satellite Data Sets,,https://www.ngdc.noaa.gov/wiki/index.php?title=NOAA_Processing_Levels,"Levels of processing that NOAA Satellite data can be in. The data processing levels applicable to NOAA satellite data. These definitions were published on a wiki page at the links below, derived from the FGDC CSDGM - Extensions for Remote Sensing Metadata (FGDC-STD-012-2002), as an informative appendix.",NotDocumented,Vocabulary,information exchange,Published Standard,Ocean Science,NOAA,,,,,,,,,,Processing Levels of NOAA Satellite Data Sets,vocabulary.jpg,https://www.ngdc.noaa.gov/wiki/index.php?title=NOAA_Processing_Levels
Processing Servers,GEOSS,,Components that accepts requests to process data using an algorithm hosted in the component. The data is accessed from a remote service.,Original CIComponent Compilation,Server application,data processing,Conceptual,,GEOSS,OGC AIP-7 Architecture report,WPS | ACCESS,,,,,,,,Processing Servers,webclient.jpg,
Products covered by the fruit and vegetable regime,,http://ec.europa.eu/agriculture/fruit-and-vegetables/list-of-products_en.pdf,"The EU actively supports the fruit and vegetable sector though its market-management scheme (element of the 'common organisation of agricultural markets'), which has 4 broad goals: 1. a more competitive and market-oriented sector 2. fewer crisis-related fluctuations in producers' income 3. greater consumption of fruit and vegetables in the EU 4. increased use of eco-friendly cultivation and production techniques.The scheme promotes product quality by applying marketing standards to certain products and supporting operational programme measures that improve or maintain product quality. This document lists the fruits and vegetables covered by the scheme. The scheme does not include bananas others than plantains, potatoes, live plants/floriculture products, olive oil or table olives.",NotDocumented,Vocabulary,information exchange,Unknown,Agriculture,Join Up -- European Union Interoperability Solutions for Public Administrations (ISA) Programme.,,,,,,,,,,Products covered by the fruit and vegetable regime,vocabulary.jpg,http://ec.europa.eu/agriculture/fruit-and-vegetables/list-of-products_en.pdf
Profiles properties,,,"This describes a vocabulary for routing Semantic Web tools toward an appropriate version, depending on the needs of the tool. For instance, it can be used to provide a DL-compatible version of an otherwise non-DL ontology.",NotDocumented,Vocabulary,information exchange,Unknown,Data Systems,Digital Enterprise Research Institute,,,,,,,,,,Profiles properties,vocabulary.jpg,http://vocab.deri.ie/yoda
Program Vocabulary,,http://www.rvdata.us/voc/program,Vocabulary for various programs associated with R2R.,NotDocumented,Vocabulary,information exchange,Unknown,Ocean Science,Rolling Deck to Repository (R2R),,,,,,,,,,Program Vocabulary,vocabulary.jpg,http://www.rvdata.us/voc/program
Project Documents Ontology,,,"The Project Documents Ontology, described using W3C RDF Schema and the Web Ontology Language, models the inherent structure and concepts of various documents in a project-specific setting, like meeting minutes, status reports etc.",NotDocumented,Vocabulary,information exchange,Unknown,Various,Digital Enterprise Research Institute,,,,,,,,,,Project Documents Ontology,vocabulary.jpg,http://vocab.deri.ie/pdo
Provenance database,CINERGI,,"stores provenance information generated throughout CINERGI metadata pipeline. Eventually, will store user annotations and additional metadata not mapped to ISO 19115/19139 schema",Original CIComponent Compilation,Component,data management,Beta,,CINERGI,,HTTP API,"JSON, XML?",,,,W3C PROV,Neo4J,,Provenance database,globe.jpg,
PRTR StandAlone SDI,,https://joinup.ec.europa.eu/software/prtr-standalone-sdi/home | https://joinup.ec.europa.eu/node/73055,a public and web based collection of tools and frameworks for interactive visualization of spatial data. It was developed following the architecture and technology of the German Pollutant Release and Transfer Register PRTR (www.thru.de) and can be integrated as an independent system into any web page (e.g. a content management system like Typo3) for presentation and visualization in the internet.,High level inventory Pivot Viewer,Open data platform,,,Various,Join Up -- European Union Interoperability Solutions for Public Administrations (ISA) Programme.,,,,,,,,,,PRTR StandAlone SDI,globe.jpg,https://joinup.ec.europa.eu/software/prtr-standalone-sdi/home | https://joinup.ec.europa.eu/node/73055
psycopg2,Ocean Observatory Initiative (OOI),http://initd.org/psycopg/,Psycopg is the most popular PostgreSQL adapter for the Python programming language. At its core it fully implements the Python DB API 2.0 specifications. Several extensions allow access to many of the features offered by PostgreSQL.,Original CIComponent Compilation,Software library,Data access,Operational,,,,,,,,,,,,psycopg2,globe.jpg,
PyDap,Ocean Observatory Initiative (OOI),http://groups.google.com/group/pydap,"Pydap is a modular python library for DAP and NetCDf in python. It provides access to IO layer of the common data model from both NetCDF files and DAP encoded data. The arrays, variables, attributes and dimensions are exposed as numpy arrays and python objects.",Original CIComponent Compilation,Software library,data processing,Operational,,http://groups.google.com/group/pydap,,,,,,,,,,PyDap,software.png,http://groups.google.com/group/pydap
Pyke,Ocean Observatory Initiative (OOI),http://pyke.sourceforge.net/,A knowledge-based inference engine (expert system) written in 100% Python.,Original CIComponent Compilation,Component,,,,,,,,,,,,,,Pyke,globe.jpg,http://pyke.sourceforge.net/
Pylos Observatory,,http://www.poseidon.hcmr.gr/eurosites/about.php,"The E1-M3A and Pylos sites were designed as open-ocean monitoring systems that can provide continuous information for physical parameters in the upper thermocline, bio-chemical parameters in the euphotic zone and air-sea interaction parameters at the sea-surface level. The E1-M3A site (Cretan Sea) and Pylos site (Southern Ionian Sea) are deployed in an area with complex hydrology where intermediate and dense water formation takes place (CIW, CDW) while water masses formed in the Levantine and the northern Aegean Sea meet and interact with those locally produced. The platform which has been upgraded recently through POSEIDON II project hosts a variety of different sensors measuring meteorological, physical and biochemical parameters. The buoy used at these sites is a Seawatch-Wavescan type which is a multi-parametric instrumentation platform and suitable for deployment in deep offshore locations (Furgo OCEANOR www.oceanor.no). The two stations are programmed to collect the data every three (3) hours and upon collection to transmit them to the receiving station. The sea-bed observatory lies on the sea bottom and it has built-in sensors capable of recording at a high resolution the water column pressure, temperature and salinity. The communication between the platform and the surface buoy is achieved through hydro-acoustic modems. The coupling of a sea bottom observing platform with a multi-parametric mooring, creates new opportunities of monitoring the ocean not only through air-sea interaction related parameters or the first few hundred meters of the water column data, but also through geo-physical and bio-chemical data of the deep sea basin that are now becoming available.",NotDocumented,Platform,,Not Evaluated,Ocean Science,National Oceanography Centre,,,,,,,,,,Pylos Observatory,globe.jpg,http://www.poseidon.hcmr.gr/eurosites/about.php
PyTables,,http://www.pytables.org/moin,PyTables is a package for managing hierarchical datasets and designed to efficiently and easily cope with extremely large amounts of data.,Original CIComponent Compilation,Software library,data processing,Operational,,,,,,,,,,,,PyTables,package-x-generic.png,http://www.pytables.org/moin
Q2O Parameter Vocabulary,,http://mmisw.org/orr/#http://mmisw.org/ont/q2o/parameter,Descriptions of the parameters used in quality control tests.,NotDocumented,Vocabulary,information exchange,Published Standard,Ocean Science,Qartod to OGC,,,,,,,,,,Q2O Parameter Vocabulary,vocabulary.jpg,http://mmisw.org/orr/#http://mmisw.org/ont/q2o/parameter
Q2O Quality Control Tests,,http://mmisw.org/orr/#http://mmisw.org/ont/q2o/test,Descriptions of the quality control tests.,NotDocumented,Vocabulary,information exchange,Published Standard,Ocean Science,Qartod to OGC,,,,,,,,,,Q2O Quality Control Tests,vocabulary.jpg,http://mmisw.org/orr/#http://mmisw.org/ont/q2o/test
R,Ocean Observatory Initiative (OOI),http://www.r-project.org/,Software to perform data analysis and display.,Original CIComponent Compilation,Desktop application,data processing,Operational,,Open Source,,,,,,,,,,R,package-x-generic.png,http://www.r-project.org/
RabbitMQ,Ocean Observatory Initiative (OOI),https://www.rabbitmq.com/,Implementation of an AMQP broker. Currently implements 0.8 and soon 0.91 versions of the AMQP spec. Light-weight high performance implementation that enables clustering of multiple brokers. Provide persistent message store for transactions. Implemented in Erlang on top of the OTP platform. Can be configured via txRabbit or via command line,Original CIComponent Compilation,System,machine interface,Operational,,,,,,,,,,,,RabbitMQ,globe.jpg,
RAUL Vocabulary,,http://lov.okfn.org/dataset/lov/vocabs/raul,A vocabulary to describe Web form widgets. Strongly aligned with the meta model of HTML Web forms.,NotDocumented,Vocabulary,information exchange,Unknown,Various,Digital Enterprise Research Institute,,,,,,,,,,RAUL Vocabulary,vocabulary.jpg,http://vocab.deri.ie/raul
RBV Metadata,,http://portailrbv.sedoo.fr/,"RBV Metadata catalog: river and drainage basin data from 15 French observatories, CSW/ISO19115, multilingual SKOS CVs. The Watershed Network (RBV) is a network of multi-disciplinary research with a mission to unite the efforts of different national organizations basic and applied research (CNRS, Universities, INRA, Cemagref, IRD) on the study of rivers , rivers and their watersheds . The RBV includes fifteen elementary observatories, both located on French territory in the South where they are the subject of advanced scientific collaborations.",NotDocumented,Catalog,,Community-Established,Hydrology,National Alliance for Environmental Research,,,,,,,,,,RBV Metadata,icon_catalog.jpg,http://portailrbv.sedoo.fr/
RDForms - representing HTML form and field semantics,,,"A vocabulary that defines how to represent HTML forms and fields (input, select, etc.) and CRUD operations on the fields.",NotDocumented,Vocabulary,information exchange,Unknown,Data Systems,Digital Enterprise Research Institute,,,,,,,,,,RDForms - representing HTML form and field semantics,vocabulary.jpg,http://vocab.deri.ie/rdforms
Re3gistry,,https://joinup.ec.europa.eu/software/re3gistry/home,"Data that are being shared between organisations often need to unambiguously refer to certain entities, such as a given topic/theme that a dataset refers to, a coordinate reference system or who the organisation is that is publishing the data. Lists that provide unique identifiers for such items, together with the items descriptions, are referred to as registers, and the systems and software that support the management of registers are known as registries.",High level inventory Pivot Viewer,Software library,JU,Unknown,Various,Join Up -- European Union Interoperability Solutions for Public Administrations (ISA) Programme.,,,,,,,,,,Re3gistry,software.png,https://joinup.ec.europa.eu/software/re3gistry/home
