Component Name#info,System,URL#link,Component Description#info,Source,Component Type#multi,Function#multi,Maturity/status,Domain Community#multi,Steward Organization,References-Text#info,Protocols#multi,InterchangeFormats#multi,InputFileFormat#multi,Input parameters#multi,Output file format#multi,InformationModels#multi,Implementation#multi,TimeToLive#info,#name,#img,#href
Abstract Resource Description Vocabulary (aardv),,http://vocab.deri.ie/aardv,"Vocabulary of methods used in other vocabularies. The 'Abstract Resource Description Vocabulary' (aardv) is the least common denominator for the discovery vocabularies XRD, POWDER, and voiD. (Source: DERI)",High level inventory Pivot Viewer,Vocabulary,information exchange,Unknown,Generic,Digital Enterprise Research Institute,,,"rdf/ttl, rdf/xml",,,,rdf,,,Abstract Resource Description Vocabulary (aardv),vocabulary.jpg,http://vocab.deri.ie/aardv
Academia.edu API,World Wide Web (WWW),http://cantl.in/pub/academia_connect.htm,The Academia.edu API will provide a means of delegation to Consumers. It is implemented as a script that responds to HTTP requests at a public URI: api.academia.edu.,NotDocumented,API,,,,,,HTTP API,,,,,,,,Academia.edu API,webclient.jpg,http://cantl.in/pub/academia_connect.htm
Academic Seismic Portal (ASP) at LDEO,Marine Geoscience Data System,http://www.marine-geo.org/portals/seismic/,"The Academic Seismic Portal (ASP) is sponsored by the National Science Foundation to organize active source seismic field data into a modern relational data management system accessible through the Internet. The system is designed principally for academic scientific use. The Academic Seismic Portal at Lamont-Doherty is also an official branch of the Antarctic Seismic Data Library System
 (SDLS), working under the auspices of the Scientific Committee on 
Antarctic Research (SCAR) and the Antarctic Treaty (ATCM XVI-12) to 
provide open access to all multichannel seismic reflection data 
collected south of 60° S for study of the structure of the earth's 
crust.  SDLS libraries maintain DVD copies of and provide access to 
processed seismic data, including that not yet publicly available from 
the main SDLS web portal .
  The libraries also enhance collaboration among originators of data and
 potential users. In addition to the library function, the Academic 
Seismic Portal offers an ever-increasing number of seismic lines for 
viewing in GeoMapApp. (http://www.marine-geo.org/portals/seismic/)
                                ",High level inventory Pivot Viewer,Web site,Data access,,Seismology,Integrated Earth Data Applications,,,,,,,,,,Academic Seismic Portal (ASP) at LDEO,globe.jpg,http://www.marine-geo.org/portals/seismic/
Academic Seismic Portal (ASP) at UTIG,Marine Geoscience Data System,http://www.ig.utexas.edu/sdc/,"The purpose of this NSF-sponsored project is to organize seismic reflection/refraction data into a modern relational database management system accessible through the Internet. The system is designed principally for academic scientific use. Users include scientists, research staff and students from around the world that have high bandwidth Internet access. The web site provides access to metadata, SEG-Y files, navigation files, seismic profile images, processing histories and more. The main features of the web site include a geographic search engine using Google Plugins, a metadata search engine, and metadata pages for the various seismic programs. Metadata are uploaded into mySQL, a public-domain SQL server, and then PHP scripts query the metadata and directories, creating web pages, displaying images, and providing ftp links. (http://www.ig.utexas.edu/sdc/about/purpose.php)",High level inventory Pivot Viewer,Web site,Data access,,Seismology,Integrated Earth Data Applications,,,,,,,,,,Academic Seismic Portal (ASP) at UTIG,globe.jpg,http://www.ig.utexas.edu/sdc/
Access to Biological Collection Data (ABCD) - version 2.06,Taxonomic Database Working Group,"http://www.tdwg.org/standards/115/   | 
http://wiki.tdwg.org/ABCD/ ","The Access to Biological Collections Data (ABCD) Schema is an evolving comprehensive standard for the access to and exchange of data about specimens and observations (a.k.a. primary biodiversity data). The ABCD Schema attempts to be comprehensive and highly structured, supporting data from a wide variety of databases. It is compatible with several existing data standards. Parallel structures exist so that either (or both) atomised data and free-text can be accommodated. Version 1.2 is currently in use with the GBIF (Global Biodiversity Information Facility) and BioCASE (Biological Collection Access Service for Europe) networks. Apart from the GBIF and BioCASE networks, the potential for the application of ABCD extends to internal networks, or in-house legacy data access (e.g. datasets from external sources that shall not be converted and integrated into an institution's own data, but be kept separately, though easily accessible). By defining relations between terms, ABCD is a step towards an ontology for biological collections.",High level inventory Pivot Viewer,Specification,Data access,Operational,Biology,Biodiversity Information Standards (TDWG),,,XML,,,,not explicit,XML schema,,Access to Biological Collection Data (ABCD) - version 2.06,globe.jpg,"http://www.tdwg.org/standards/115/   | 
http://wiki.tdwg.org/ABCD/ "
"Access to Biological Collection Data, DNA extension (ABCDDNA)",Taxonomic Database Working Group,http://www.tdwg.org/standards/640/,"Download page for ABCDDNA extensions. Clicking the download link prompts the download of a document detailing the ABCDDNA. ABCDDNA is an extension, built on the existing ABCD standards, that specifies metadata standards for DNA data. Note: Document is not at final version. ABCDDNA is a theme specific extension for ABCD (Access to Biological Collections Data) created to facilitate storage and exchange of data related to DNA collection units, such as DNA extraction specifics, DNA quality parameters, and data characterising products of downstream applications, along with the relation to the analysed voucher specimen. ABCDDNA is an XML Schema extension to ABCD 2.06, which offers only a rudimentary set of DNA-specific data (Sequences). This document specifies the DNA extension for ABCD 2.06. (Source: TDWG)",High level inventory Pivot Viewer,Specification,Data access,Operational,Biology,Biodiversity Information Standards (TDWG),,,XML,,,,not explicit,XML schema,,"Access to Biological Collection Data, DNA extension (ABCDDNA) ",globe.jpg,http://www.tdwg.org/standards/640/
Access to Biological Collection Databases Extended for Geosciences (ABCDEFG),Taxonomic Database Working Group,http://www.geocase.eu/efg,"ABCDEFG (Access to Biological Collection Databases Extended for Geosciences) is an XML-Schema (Extensible Markup Language) developed for use with palaeontological, mineralogical and geological digitalized collection data. It extends the ABCD-XML-Schema (Access to Biological Collection Databases) used by GBIF (Glocal Biodiversity Iformation Facility) (Source: Geocase)",High level inventory Pivot Viewer,Specification,Data access,Conceptual,Data Systems,Biodiversity Information Standards (TDWG),,,XML,,,,,XML schema,,Access to Biological Collection Databases Extended for Geosciences (ABCDEFG),globe.jpg,http://www.geocase.eu/efg
Acquisition scheduler,Ocean observatory initiative (OOI),http://oceanobservatories.org/,"The Ocean Observatories Initiative (OOI) will construct a networked infrastructure of science-driven sensor systems to measure the physical, chemical, geological and biological variables in the ocean and seafloor. Greater knowledge of these variables is vital for improved detection and forecasting of environmental changes and their effects on biodiversity, coastal ecosystems and climate. The OOI, a project funded by the National Science Foundation,
 is planned as a networked infrastructure of science-driven sensor 
systems to measure the physical, chemical, geological and biological 
variables in the ocean and seafloor. The OOI will be one fully 
integrated system collecting data on coastal, regional and global 
scales. The OOI Program is managed and coordinated by the OOI Project 
Office at the Consortium for Ocean Leadership,
 in Washington, D.C., and is responsible for construction and initial 
operations of the OOI network.  Three major Implementing Organizations 
are responsible for construction and development of the overall program.
 Woods Hole Oceanographic Institution and its partners, Oregon State University and Scripps Institution of Oceanography are responsible for the coastal and global moorings and their autonomous vehicles. The University of Washington is responsible for cabled seafloor systems and moorings. The University of California, San Diego, is implementing the cyberinfrastructure component. Rutgers, The State University of New Jersey, with its partners University of Maine and Raytheon Mission Operations and Services, is responsible for the education and public engagement software infrastructure. (http://oceanobservatories.org/about/)",Original CIComponent Compilation,Component,scheduling,Conceptual,,,,,,,,,,,,Acquisition scheduler,globe.jpg,http://oceanobservatories.org/
Action plan generator,CINERGI,http://earthcube.org/group/cinergi,recommends components and workflows for fixing issues reported in validation process; like DPLA action plans,Original CIComponent Compilation,Component,workflow management,Planned,,,See OGC TEAM gitHub,,"JSON, XML?",,,,"interchange format for describing validation problems, e.g. EARL, TestNG",Java,,Action plan generator,globe.jpg,http://earthcube.org/group/cinergi
ActionVerb Schema,Digital Enterprise Research Institute (DERI),http://vocab.deri.ie/av,"This is an rdf schema for defining an ActionVerb. It defines the concept ActionVerb as an rdfs:subClassOf skos:Concept. It defines for this concept three properties: (1) av:hasPart which is an rdf:Property (2) av:hasOptionalPart which is an rdf:Property, both of them are used to create meronymy relations between ActionVerbs and (3) av:hasLevel which is an owl:DatatypeProperty that indicates the level of the current action verb in the hierachy built using the two previous properties (Source: DERI)",NotDocumented,Vocabulary,information exchange,Unknown,Data Systems,Digital Enterprise Research Institute,,,"rdf/ttl, rdf/xml",,,,"foaf, rdf, vann, adms, dc, dcterms",RDF,,ActionVerb Schema ,vocabulary.jpg,http://vocab.deri.ie/av
Activity Type Vocabulary,,http://www.rvdata.us/voc/activitytype,vocabulary listing on a web page (no machine interface?),NotDocumented,Vocabulary,information exchange,Unknown,Ocean Science,Rolling Deck to Repository (R2R),,,,,,,,,,Activity Type Vocabulary,vocabulary.jpg,http://www.rvdata.us/voc/activitytype
ADMS API Vocabulary,,http://vocab.deri.ie/admsapi,This a vocabulary used in the RESTful ADMS Exchange API,NotDocumented,Vocabulary,information exchange,Unknown,Data Systems,Digital Enterprise Research Institute,,HTTP API,,,,,,,,ADMS API Vocabulary,vocabulary.jpg,http://vocab.deri.ie/admsapi
Advanced Message Queuing Protocol (AMQP),,http://www.amqp.org,"AMQP enables complete interoperability for messaging middleware, both the networking protocol and the semantics of broker services are defined in AMQP. The AMQP model explicitly defines the server's semantics because interoperability demands the same semantics for any server implementation. To enable technology-neutral interoperability, AMQP defines an efficient wire-level format with modern features. Financial institution focus. Receive, Queue and route messages. ISO/IEC 19464, also an OASIS adopted standard.",Original CIComponent Compilation,Specification,information exchange,Community Standard,,ISO | OASIS,,,,,,,,,,Advanced Message Queuing Protocol (AMQP),globe.jpg,http://www.amqp.org
Advanced Regional Prediction System (ARPS) Vocabularies,,http://www.caps.ou.edu/ARPS/download/code/pub/ARPS.docs/ARPS4DOC.PDF/arpsapxD.pdf,Vocabularies for regional to stormscale atmospheric modeling / prediction. Includes: Global Time-Dependent Prognostic Variable; Time-Dependent Diagnostic Variables Local to Each Time Step; Time-Dependent Diagnostic Variables Not Local to a Single Time Step; Time-Independent Variables; Time-Independent Parameters; Parameters that May Change with Time,NotDocumented,Vocabulary,computation,Operational,Atmosphere,Center for Analysis and Prediction of Storms (CAPS),,human readable,pdf,,,,,,,Advanced Regional Prediction System (ARPS) ,software.png,http://www.caps.ou.edu/ARPS/download/code/pub/ARPS.docs/ARPS4DOC.PDF/arpsapxD.pdf
Africa Soil Information Service Data and Map Portal,Africa Soil Information Service (AfSIS),http://www.africasoils.net/data/data-portal-home1,Entry point for finding and getting AfSIS data,Original CIComponent Compilation,Web site,Data access,Operational,Soil Science,Africa Soil Information Service,,,,,,,,,,Africa Soil Information Service Data and Map Portal,globe.jpg,http://www.africasoils.net/data/data-portal-home1
AgreementMaker,,http://agreementmaker.org/wiki/index.php/AgreementMaker,"user friendly, powerful, and flexible ontology and schema matching system. Last wiki update 2013",Original CIComponent Compilation,Component,information exchange,Operational,Data Systems,"Advances in Information Systems Laboratory, University of Illinois at Chicago",,,"RDFS, OWL, XML",,,,RDF/OWL,Java,,AgreementMaker,globe.jpg,http://agreementmaker.org/wiki/index.php/AgreementMaker
AGRIS Application Profile,,http://www.fao.org/docrep/008/ae909e/ae909e00.htm,"The AGRIS Application Profile for the International Information System on Agricultural Sciences and Technology Guidelines on Best Practices for Information Object Description. The goal of the AGRIS Application Profile (AGRIS AP) is to facilitate interoperability of metadata formats currently in use to enable linking of various types of agricultural information, therefore allowing users to perform cross-searches and other value added services. This approach would also facilitate the harvesting of data from participating countries; with the application of the AGRIS AP model, this harvesting process could be automated.",High level inventory Pivot Viewer,Specification,data management,Conceptual,Agriculture,UN Food and Agricultural Organization,,,,,,,,,,AGRIS Application Profile,globe.jpg,http://www.fao.org/docrep/008/ae909e/ae909e00.htm
AGROVOC,,http://aims.fao.org/standards/agrovoc,"AGROVOC is a controlled vocabulary covering all areas of interest of the Food and Agriculture Organization (FAO) of the United Nations, including food, nutrition, agriculture, fisheries, forestry, environment etc. It is published by FAO and edited by a community of experts. AGROVOC consists of over 32,000 concepts available in 21 languages: Arabic, Chinese, Czech, English, French, German, Hindi, Hungarian, Italian, Japanese, Korean, Lao, Persian, Polish, Portuguese, Russian, Slovak, Spanish, Thai, Turkish and Ukrainian.",NotDocumented,Vocabulary,Data access,Operational,Agriculture,UN Food and Agricultural Organization,,,,,,,,"SKOS-XL, Linked Open Data (LOD)",,AGROVOC,vocabulary.jpg,http://aims.fao.org/standards/agrovoc
Amazon EC2,Ocean Observatory Initiative (OOI),http://aws.amazon.com/,Cloud computing: remote virtual machine environment for Amazon Elastic Cloud.,Original CIComponent Compilation,Cloud Platform,,Operational,,Amazon,,,,,,,,,,Amazon EC2,dataservice.jpg,http://aws.amazon.com/
Amino Acid Racemization (AAR) Data from NOAA,,http://www.ncdc.noaa.gov/paleo/aar.html,"Amino Acid Racemization (AAR) by location submitted by scientists. Most amino acids can have two different configurations, ""D"" or ""L"". Living organisms generally have amino acids in the ""L"" configuration, but when the organism dies, the ratio of D/L moves slowly toward equilibrium, a process called racemization. Measuring the ratio of D/L in a geologic sample containing preserved amino acids can therefore allow calculations of the age of the sample (Source: NOAA)",NotDocumented,Database,Data access,Operational,Geochronolgy,NOAA National Oceanographic Data Center,,,txt | pdf,,,,,,,Amino Acid Racemization (AAR) Data from NOAA,database.jpg,http://www.ncdc.noaa.gov/paleo/aar.html
AMMA Data Catalogue,,http://catalogue.amma-international.org/,"Catalog of geodesy information of West Africa and Gulf of Guinea. The AMMA project includes in situ measurements at many locations of West Africa and in the Gulf of Guinea, an intensive use of satellite data and diverse modelling studies. Therefore, the AMMA database aims at storing a great amount and a large variety of data, and at providing the data as rapidly and safely as possible to the AMMA research community. In order to stimulate the exchange of information and collaboration between researchers from different disciplines or using different tools, the database provides a detailed description of the products and uses standardized formats. The database is now developed jointly at MEDIAS-France in Toulouse and at IPSL in Paris, and will be mirrored in Niamey as early as 2008.",NotDocumented,Catalog,data storage,Unknown,Geodesy,African Monsoon Multidisciplinary Analysis,,,,,,,,,,AMMA Data Catalogue,icon_catalog.jpg,http://catalogue.amma-international.org/
Annotation CReatiON for Your Media (ACRONYM) Ontology,,http://vocab.deri.ie/acronym,"Ontology for describing wireless devices at the time that they function in the creation of a resource. The Annotation CReatiON for Your Media (ACRONYM) ontology's purpose is to lend context from the real-world (Ambient Intelligence) to the creation of resources. More specifically, it can be used to capture the presence of relevant wireless devices at the time of resource creation. This ontology's original purpose is to be integrated with other ontologies from social networking, multimedia, geography and context-awareness to aid the semi-automatic annotation of media, but more generally it can be used for Ambient Intelligence applications. For example, it can be used to capture the unique Bluetooth addresses of devices near a cameraphone at the time of photograph capture and later link those addresses to the people that own those devices. Alternatively, it can be used to track the RFID addresses of products in a factory and update their status in an information system. The ontology is open to and welcomes extension with various other types of wireless addressing protocols/formats and application-specific semantics.",NotDocumented,Vocabulary,Data access,Unknown,Data Systems,Digital Enterprise Research Institute,,,,,,,,,,Annotation CReatiON for Your Media (ACRONYM) Ontology,vocabulary.jpg,http://vocab.deri.ie/acronym
Annotopia,World Wide Web (WWW),https://github.com/Annotopia/Annotopia,"Open Annotation services platform. Universal annotation hub, collections of modules that provide services for creating, persisting, searching and enriching annotation. OpenAnnotation compliant. NIF and BioPortal connectors. Aggregate annotation and provide through single information exchange. Defines an OpenAnnotation RESTful API.",Original CIComponent Compilation,Cloud Platform,annotation,Operational,,Architected and developed by Dr. Paolo Ciccarese. Annotopia is a product of the MIND Informatics group - at Massachusetts General Hospital - directed by Tim Clark. http://www.slideshare.net/paolociccarese/annotopia-overview-by-paolo-ciccarese,,HTTP API,JSON-LD,,,,W3C Open Annotation,"Jena, Virtuoso, JSON-LD internal objects, Spring Security, OpenID, OpenAuth",,Annotopia,dataservice.jpg,https://github.com/Annotopia/Annotopia
Antarctic and Southern Ocean Data Portal (ASODS),,http://www.marine-geo.org/portals/antarctic/,"The Antarctic & Southern Ocean Data Portal provides access to geoscience data from the Antarctic region, primarily acquired with the R/Vs Nathaniel B. Palmer and Laurence M. Gould. Seafloor bathymetry, subbottom profiling, trackline gravity and magnetics, meteorological, and water column data as well as basic cruise information for all Palmer and Gould expeditions is available through this data portal. MGDS also processes and quality assures ship-based multibeam bathymetry data acquired on the Palmer for integration into the Global Multi-Resolution Topography (GMRT) Synthesis, a gridded compilation of seafloor bathymetry data can be accessed through GeoMapApp, GMRT MapTool and through an OGC-compliant Web Map Service. GeoMapApp can also be used to access additional regional bathymetric grids, seismic, radar, gravity and magnetics profiles as well as other map and grid compilations for the Antarctic continent including LIMA. The US Antarctic Program Data Coordination Center (USAP-DCC) is also hosted as part of the MGDS to help scientists find Antarctic scientific data of interest and to submit their data for curation and long term preservation in accordance with their obligations under the NSF Division of Polar Programs Guidelines for Scientific Data. Member of the NSF Antarctic & Arctic Data Consortium. (http://www.marine-geo.org/portals/antarctic/)",High level inventory Pivot Viewer,Web site,Data access,,Marine Geoscience,Integrated Earth Data Applications,,,,,,,,,,Antarctic and Southern Ocean Data Portal (ASODS),globe.jpg,http://www.marine-geo.org/portals/antarctic/
Antarctic Master Directory (AMD),International Directory Network (IDN),http://idn.ceos.org/portals/Home.do?Portal=amd&MetadataType=0; WFS to search directory: http://www.usap-data.org/exe/mapserv?map=/public/mgg/web/www.usap-data.org/htdocs/services/ogc.map&service=wfs&version=1.0.0&request=getcapabilities,Global Change Master Directory portal for Antarctic data,Original CIComponent Compilation,Web site,Discovery,Operational,Polar Science,NASA GCMD CEOS,,WFS,XML,,,,,,,Antarctic Master Directory (AMD),globe.jpg,http://idn.ceos.org/portals/Home.do?Portal=amd&MetadataType=0; WFS to search directory: http://www.usap-data.org/exe/mapserv?map=/public/mgg/web/www.usap-data.org/htdocs/services/ogc.map&service=wfs&version=1.0.0&request=getcapabilities
Antarctic Meteorological Research Center Repository for Archiving and Managing and Accessing Diverse Data (AMRC RAMADDA),,https://amrc.ssec.wisc.edu/repository,currently contains no content...,NotDocumented,Data Access,,,Climatology,Antarctic Meteorological Research Center,,,,,,,,,,Antarctic Meteorological Research Center Repository for Archiving and Managing and Accessing Diverse Data (AMRC RAMADDA),dataservice.jpg,https://amrc.ssec.wisc.edu/repository
ANTARES,Fixed point Open Ocean Observatory network (FixO3),http://www.fixo3.eu/observatory/antares/,"Multidisciplinary, permanent marine observatory providing high-bandwidth real-time data transmission from deep-sea for geosciences and marine environmental sciences. Site is part of the MOOSE network providing real-time data transmission through two deep cabled moorings. These moorings are complemented by stand-alone mooring near the junction box. Physical and biogeochemical parameters recorded by autonomous sensors with regular maintenance. In addition monthly ship occupation for CTD profiles and seawater collection. Cabled extension of the neutrino telescope is offering connectors for direct link to shore in addition to operational seismometer already in place.",High level inventory Pivot Viewer,Platform,data acquisition,Operational,Ocean Science,CNRS-IFREMER-CPPM,,,ASCII NetCDF,,,,,,,ANTARES,globe.jpg,http://www.fixo3.eu/observatory/antares/
Antelope ORB,,"http://www.brtt.com/software.html 
http://www.lindquistconsulting.com/antelope.php","BRTT Antelope is a real-time execution environment for data acquisition and manipulation processes. It consists of a RTexec scheduler, the Datascope hierachical database and the ORB (Object Ring Buffer) that stores and forwards data packets from producers to consumers. Data acquisition processes can be physically separate from the ORB as long as there is a reliable network. ORBs can be bridged to further ORBs, thereby creating a scalable data acquisition architecture. A substantial set of instrument drivers are existing for the Antelope platform, in particular the sophisticated Quanterra Q330 data logger driver. Antelope is used in the USArray ANL and RoadNet",Original CIComponent Compilation,Execution environment,data acquisition,Operational,Environmental science,BRTT,,,,,,,ORB (Object Ring Buffer),"US Array ANL, RoadNET",,Antelope ORB  ,globe.jpg,"http://www.brtt.com/software.html 
http://www.lindquistconsulting.com/antelope.php"
ANZ-MEST - Metadata Entry and Search Tool,,http://bluenetdev.its.utas.edu.au/download/bluenetmest.html,"provides information about the identification, the extent, the quality, the spatial and temporal schema, spatial reference, and distribution of digital geographic data.",High level inventory Pivot Viewer,Application,DCC,Unknown,Generic,Digital Curation Centre,,,,,,,,,,ANZ-MEST - Metadata Entry and Search Tool,globe.jpg,http://bluenetdev.its.utas.edu.au/download/bluenetmest.html
ANZLIC Metadata Profile,,http://www.anzlic.gov.au/resources/anzlic_metadata_profile,"PDF or Doc files that describe the ANZLIC standard for spatial metadata. The ANZLIC Metadata Profile adopts established Australian / New Zealand and International Standards. Widespread adoption of the Profile will facilitate interoperability within and between agencies and jurisdictions, both within the region and internationally, by providing a consistent basis for communicating information about resources.",High level inventory Pivot Viewer,Specification,DCC,Conceptual,Generic,Digital Curation Centre,,,,,,,,,,ANZLIC Metadata Profile,globe.jpg,http://www.anzlic.gov.au/resources/anzlic_metadata_profile
