Component Name#info,System,URL#link,Component Description#info,Source,Component Type#multi,Function#multi,Maturity/status,Domain Community#multi,Steward Organization,References-Text#info,Protocols#multi,InterchangeFormats#multi,InputFileFormat#multi,Input parameters#multi,Output file format#multi,InformationModels#multi,Implementation#multi,TimeToLive#info,#name,#img,#href
Delta Format,,http://www.tdwg.org/standards/107/,"When taxonomic descriptions are prepared for input to computer programs, the form of the coding is usually dictated by the requirements of a particular program or set of programs. This restricts the type of data that can be represented, and the number of other programs that can use the data. Even when working with a particular program, it is frequently necessary to set up different versions of the same basic data, for example, when using restricted sets of taxa or characters to make special-purpose keys. The potential advantages of automation, especially in connexion with large groups, cannot be realized if the data have to be restructured by hand for every operation. The DELTA (DEscription Language for TAxonomy) system was developed to overcome these problems. It was designed primarily for easy use by people rather than for convenience in computer programming, and is versatile enough to replace the written description as the primary means of recording data. Consequently, it can be used as a shorthand method of recording data, even if computer processing of the data is not envisaged.",High level inventory Pivot Viewer,Specification,,Conceptual,Biology,Biodiversity Information Standards (TDWG),,,,,,,,,,Delta Format,globe.jpg,http://www.tdwg.org/standards/107/
Device Model Vocabulary,,http://www.rvdata.us/voc/model,Listing of instrumentation devices used in R2R system,High level inventory Pivot Viewer,Vocabulary,information exchange,Not Evaluated,Ocean Science,Rolling Deck to Repository (R2R),,,,,,,,,,Device Model Vocabulary,vocabulary.jpg,http://www.rvdata.us/voc/model
Device Type Vocabulary,,http://www.rvdata.us/voc/devicetype,"Code, descriptions and examples of devices used in data collection.",NotDocumented,Vocabulary,information exchange,Unknown,Ocean Science,Rolling Deck to Repository (R2R),,,,,,,,,,Device Type Vocabulary,vocabulary.jpg,http://www.rvdata.us/voc/devicetype
DIFF Vocabulary,,http://vocab.deri.ie/diff,This vocabulary defines a set of terms for describing changes (diffs) to plain text documents. It can be used for example to model diffs between wiki page revisions.,NotDocumented,Vocabulary,information exchange,Unknown,Various,Digital Enterprise Research Institute,,,,,,,,,,DIFF Vocabulary,vocabulary.jpg,http://vocab.deri.ie/diff
Digi RealPort,Ocean Observatory Initiative (OOI),http://www.digi.com,"DigiÃ¢â‚¬â„¢s RealPort software leverages TCP/IP network infrastructure to provide a virtual connection to serial devices. The software is installed directly on the server and allows applications to talk to devices across a network as though the devices were directly attached to the server. In actuality, the devices are connected to a Digi device server or terminal server somewhere on the network",Original CIComponent Compilation,Instrument interface,hardware controller,Operational,,Digi,,TCP/IP,,,,,,,,Digi RealPort,globe.jpg,http://www.digi.com
Directory Interchange Format (DIF),,http://gcmd.nasa.gov/add/difguide/,"Product of an Earth Science and Applications Data Systems Workshop (ESADS) held February 24-26, 1987 on catalog interoperability (CI). The workshop recommended that a ""...first step towards data system interoperability, Catalog Interoperability (CI), the ability to find information about data held at other sites..."", be made. The DIF does not compete with other metadata standards. It is simply the ""container"" for the metadata elements that are maintained in the IDN database, where validation for mandatory fields, keywords, personnel, etc. takes place. The DIF is used to create directory entries which describe a group of data. A DIF consists of a collection of fields which detail specific information about the data. Eight fields are required in the DIF; the others expand upon and clarify the information. Some of the fields are text fields, others require the use of controlled keywords (sometimes known as ""valids""). The DIF allows users of data to understand the contents of a data set and contains those fields which are necessary for users to decide whether a particular data set would be useful for their needs.",High level inventory Pivot Viewer,Interchange Format,,Published Standard,Geospatial,NASA,,,,,,,,,,Directory Interchange Format (DIF),globe.jpg,http://gcmd.nasa.gov/add/difguide/
DisConBB: netCDF2WaterML,DisConBB,,Unidata THREDDS conversion utility. Converts a CDM-compliant timeseries datasets served by a THREDDS server to a WaterML timeseries.,ChristianWardGarrison,Server application,transformation,In Development,Generic,Unidata,,HTTP API,,Unidata Common Data Model compliant ,,WaterML 2,WaterML-netCDF common model,THREDDS web service,,ncdf2waterml,globe.jpg,
DisConBB: USGS NWIS WaterML to netCDF/CF,DisConBB,,"Tufts University conversion utility. Use NODC templates for CF usage, extend with CSDMS parameter",DavidArctur,Component,transformation,In Development,Hydrology,DisConBB,,,,WaterML 1.1,,netCDF 4,WaterML-netCDF common model,R,,nwis2ncdf,globe.jpg,
Discovery Metadata Service,Data.gov UK,http://location.defra.gov.uk/resources/discovery-metadata-service/,"The UK Location infrastructure enables you to find, share and reuse, location data, including data published under the INSPIRE Directive. Web site includes links for other resources for location services in the UK",High level inventory Pivot Viewer,Web site,Discovery,Conceptual,Data Systems,Data.gov UK,,,,,,,,,,Discovery Metadata Service,globe.jpg,http://location.defra.gov.uk/resources/discovery-metadata-service/
docBuilder Tool,Global Change Information System,http://gcmd.nasa.gov/KeywordSearch/Metadata.do?Portal=GCMD&KeywordPath=%5BFreetext%3D%27docbuilder%27%5D%7CRefine+By+ServiceParameters%7CMETADATA+HANDLING%7CAUTHORING+TOOLS&EntryId=GCMD_docBUILDER&MetadataView=Full&MetadataType=1&lbnode=mdlb3#maincontent,"NASA's Global Change Master Directory (GCMD) web-based docBUILDER authoring tool provide the capability to create and modify metadata descriptions for GCMD metadata records include data set descriptions, service descriptions and ancillary information (Data Centers, Projects, Instruments, Platforms). The authoring tool is widely used among NASA's Distributed Active Archive Centers (DAACs). Required EOSDIS user account to use",Original CIComponent Compilation,Web site,metadata acquisition,,,"EOSDIS, GCMD, NASA",,,,,,,,,,docBuilder Tool,globe.jpg,http://gcmd.nasa.gov/KeywordSearch/Metadata.do?Portal=GCMD&KeywordPath=%5BFreetext%3D%27docbuilder%27%5D%7CRefine+By+ServiceParameters%7CMETADATA+HANDLING%7CAUTHORING+TOOLS&EntryId=GCMD_docBUILDER&MetadataView=Full&MetadataType=1&lbnode=mdlb3#maincontent
Docucomp,NGDC,http://www.ngdc.noaa.gov/docucomp/,"Docucomp is a web application for managing XML components as part of an Enterprise Documentation Architecture. A component is a snippet of XML describing a specific piece of metadata content. They are stored in a database and managed with REST web services. The REST services support insert, search, update and delete operations.",Original CIComponent Compilation,Component,resource access,,,,,,,,,,,,,Docucomp,globe.jpg,
GeoSoft DRAT Crawler,Geosoft,http://github.com/chrismattmann/drat/ ,"Returns services and dataset descriptions associated with them. Crawls edu, gov etc domains",YolandaGil,Application,Discovery,Operational / In Development,Generic,USC & JPL, ,XML-RPC | HTTP REST,"CSV, JSON",code repository,code repository,CSV DRAT report (aka RAT report),RAT CSV,"Apache OODT, Apache Tika, Apache RAT","Until Github goes away and if it does, Apache",DRAT,globe.jpg,http://github.com/chrismattmann/drat/ 
DRDC Atlantic NADAS Parameter Codes,,http://mmisw.org/orr/#http://mmisw.org/ont/drdc/parameter,"Parameter codes used by the QUEST Non acoustic data acquisition system (NADAS). All codes used in NADAS are numeric (e.g., 013). The alpha codes (e.g., WTSS) have been added to support the descriptions of the numeric codes. The alpha codes are not actually part of the data stream.",NotDocumented,Vocabulary,information exchange,Community-Established,Ocean Science,Defence Research and Development Canada,,,,,,,,,,DRDC Atlantic NADAS Parameter Codes,vocabulary.jpg,http://mmisw.org/orr/#http://mmisw.org/ont/drdc/parameter
Drupal,World Wide Web (WWW),https://www.drupal.org/,Drupal is a content management system which allows you to create and maintain many different types of websites without needing to know any coding languages.,Original CIComponent Compilation,Server application,Content Management,,,,,,,,,,,,,Drupal,globe.jpg,
Dryad Digital Repository,,http://datadryad.org/,"The Dryad Digital Repository is a curated resource that makes the data underlying scientific publications discoverable, freely reusable, and citable. Dryad provides a general-purpose home for a wide diversity of datatypes. Dryad welcomes data submissions related to published, or accepted, scholarly publications. Dryad's objectives are to serve as a repository for tables, spreadsheets, and all other kinds of data that do not have another discipline-specific repository, and to enable scientists to: validate published findings, explore new analysis methodologies, repurpose data for research questions unanticipated by the original authors, perform synthetic studies, and utilize data for educational purposes. Dryad is governed by a nonprofit membership organization. Membership is open to any stakeholder organization, including but not limited to journals, scientific societies, publishers, research institutions, libraries, and funding organizations. Publishers are encouraged to facilitate data archiving by coordinating the submission of manuscripts with submission of data to Dryad. Learn more here. Dryad originated from an initiative among a group of leading journals and scientific societies in evolutionary biology and ecology to adopt a joint data archiving policy (JDAP) for their publications, and the recognition that easy-to-use, sustainable, community-governed data infrastructure was needed to support such a policy. See this page to learn more about JDAP.",Original CIComponent Compilation,Repository,data management,,,,,,,,,,,,,Dryad Digital Repository,database.jpg,http://datadryad.org/
DYFAMED station in the Ligurian Sea,Mediterranean Ocean Observing System for the Environment (MOOSE),http://www.obs-vlfr.fr/sodyf/,"In the framework of the French MOOSE project (Mediterranean Ocean Observing System for the Environment), an eulerian time series so-called DYFAMED (Ligurian Sea) performs since 1991 a monthly multidisciplinary monitoring to observe: 1) the evolution of the water mass properties (LIW and WMDW), 2) the carbon export change and 3) the variability of the biological species relative to climate forcing (temperature, acidification). In addition to monthly CTD profiles, a standalone mooring is located in the DYFAMED site with CTD and currents sensors (since 2009) and two sediment traps (Technicap PPS5) for collecting large particles and zooplankton every 15 days (48 samples per year).",High level inventory Pivot Viewer,Platform,data acquisition,Operational,,DYnamics of Atmospheric Flows in MEDiterranean Sea (DYFAMED),,,,,,,,,,DYFAMED station in the Ligurian Sea,globe.jpg,http://www.obs-vlfr.fr/sodyf/
e-SOTER Regional pilot platform,Global Soil Observing System,http://www.esoter.net/ | http://eusoils.jrc.ec.europa.eu/projects/esoter/,"A web-based regional pilot platform with data, methodology, and applications, using remote sensing to validate, augment and extend existing data for a global soil and terrain database. providing a Regional Pilot Platform that can be extended worldwide, for example under the proposed Gates Foundation initiative GlobalSoilMap.net. e-SOTER adds value by: 1) using remotely-sensed data both to validate and correct existing survey data; 2) to generate new data surfaces; 3) improving the quality of results of applications previously based on legacy data alone; and 4) providing a web service that delivers both selected data in an easy-to-use format and procedures to compile e-SOTER databases locally and upload these data to the European database if they meet prescribed quality standards. e-SOTER makes use of detailed digital elevation models (DEMs), recent advances in remote sensing, and new analytical tools for landform analysis, parent material detection and soil pattern recognition - both to extend the legacy soil data and to build a framework for new data acquisition.",NotDocumented,Cloud Platform,,,Soil Science,,,,,,,,,,,e-SOTER Regional pilot platform,dataservice.jpg,http://www.esoter.net/ | http://eusoils.jrc.ec.europa.eu/projects/esoter/
E2-M3A (Southern Adriatic Sea Observatory) - NOTHI,,http://nettuno.ogs.trieste.it/e2-m3a/,"The E2-M3A observatory is positioned in the centre of the cyclonic gyre where deep convection process takes place, involving both the atmosphere and the ocean dynamics and forming new dense and oxygenated waters, thus triggering the solubility and the biological pump. The E2-M3A observatory is particularly devoted towards studies for characterizing the long-term changes of Adriatic sea in response to local climatic forcing.",NotDocumented,Platform,,,Ocean Science,Fixed-point Open Ocean Observatories  FIXO3,,,,,,,,,,E2-M3A (Southern Adriatic Sea Observatory) - NOTHI,globe.jpg,http://nettuno.ogs.trieste.it/e2-m3a/
Earth Science Markup Language (ESML),,http://gcmd.nasa.gov/records/01-ghrc_ESML-00.html,"Markup language developed specifically for Earth Science resources based on XML. The Earth Science Markup Language (ESML) is a specialized markup language for Earth Science metadata based on the eXtensible Markup Language (XML?). It is designed to provide a standard way for describing content, structure and semantic information of a data file, thus facilitating development of dataset-independent search, visualization, and analysis tools without requiring data to be in any particular format or formats (Source: GCMD)",High level inventory Pivot Viewer,Interchange Format,,Community-Established,Generic,NASA,,,,,,,,,,Earth Science Markup Language (ESML),globe.jpg,http://gcmd.nasa.gov/records/01-ghrc_ESML-00.html
EarthChem Library,,http://www.earthchem.org/library,"A data repository for digital content from geoscience research. The EarthChem Library is a data repository that archives, publishes and makes accessible data and other digital content from geoscience research (analytical data, data syntheses, models, technical reports, etc.).",NotDocumented,Catalog,,AdHoc,Geochemistry,Integrated Earth Data Applications,,,,,,,,,,EarthChem Library,icon_catalog.jpg,http://www.earthchem.org/library
EarthChem Portal Search,,http://www.earthchem.org/portal,"The EarthChem Portal offers a ""one-stop-shop"" for geochemistry data of the solid earth with access to complete data from multiple data systems. The portal returns integrated search results from the federated databases PetDB, SedDB, GEOROC, NavDat, USGS, and GANSEKI. The portal features mapping and visualization tools. Home page for the EarthChem Portal Search. Used to access data from various databases including SedDB, PetDB, and more. Click 'Search' to set queries for various fields",High level inventory Pivot Viewer,Web site,data acquisition,AdHoc,Geochemistry,Integrated Earth Data Applications,,,,,,,,,,EarthChem Portal Search,globe.jpg,http://www.earthchem.org/portal
EarthChem vocabularies,,http://www.earthchem.org/resources/vocabularies,list of vocabularies,NotDocumented,Catalog,,Community-Defacto,Geochemistry,Integrated Earth Data Applications,,,,,,,,,,EarthChem vocabularies,icon_catalog.jpg,http://www.earthchem.org/resources/vocabularies
EarthData Code collaborative,EOSDIS,https://ecc.earthdata.nasa.gov/,"a platform for development, testing, and discovery of Earthdata-related applications and services.",Original CIComponent Compilation,Platform,software development,,,NASA,,,,,,,,,,EarthData Code collaborative,globe.jpg,https://ecc.earthdata.nasa.gov/
ECHO: OpenSearch + homegrown,,https://api.echo.nasa.gov/catalog-rest/catalog-docs/index.html,"View of ECHO resources (XML or JSON) using HTTP methods The ECHO REST Web Services API is a resource-oriented view of resources in ECHO that can be accessed through the use of HTTP with XML or JSON. These resources can be created, retrieved, updated, and deleted by using the HTTP methods POST, GET, PUT, and DELETE (Source: ECHO)",NotDocumented,Catalog,,Community-Defacto,Atmosphere,NASA,,,,,,,,,,ECHO: OpenSearch + homegrown,icon_catalog.jpg,https://api.echo.nasa.gov/catalog-rest/catalog-docs/index.html
Economic Botany Data Collection Standard,,http://www.tdwg.org/standards/103/,"Studies on the uses of plants are becoming increasingly important. Standardisation of terms and a unified system to describe uses are of enormous benefit to gatherers of information, especially where exchanges of data sets are involved. The standard provides a system whereby uses of plants (in their cultural context) can be described, using standardised descriptors and terms, and attached to taxonomic data sets. It resulted from discussions at the International Working Group on Taxonomic Databases for Plant Sciences (TDWG) between 1989 and 1992.",High level inventory Pivot Viewer,Specification,TDWG,Conceptual,Biology,Biodiversity Information Standards (TDWG,,,,,,,,,,Economic Botany Data Collection Standard,globe.jpg,http://www.tdwg.org/standards/103/
EDMED Metadata Profile,,https://www.bodc.ac.uk/data/information_and_inventories/edmed/,"The European Directory of Marine Environmental Datasets metadata scheme, which is a profile of ISO 19115.",High level inventory Pivot Viewer,Specification,DCC,Conceptual,Ocean Science,Digital Curation Centre,,,,,,,,,,EDMED Metadata Profile,globe.jpg,https://www.bodc.ac.uk/data/information_and_inventories/edmed/
ElasticSearch,,http://www.elasticsearch.org/,"Elasticsearch is a flexible and powerful open source, distributed, real-time search and analytics engine. Architected from the ground up for use in distributed environments where reliability and scalability are must haves, Elasticsearch gives you the ability to move easily beyond simple full-text search. Through its robust set of APIs and query DSLs, plus clients for the most popular programming languages, Elasticsearch delivers on the near limitless promises of search technology",Original CIComponent Compilation,Server application,search,Operational,,,,,,,,,,,,ElasticSearch,globe.jpg,http://www.elasticsearch.org/
electronic geological management system (EGEMS),,,"a database program for geological collections; incorporate existing data and add much more, including data for research materials which could not have easily been done using their previous system.",Original CIComponent Compilation,Application,data management,,,,Sarah Timm Master's thesis,,,,,,,,,electronic geological management system (EGEMS),globe.jpg,
Emergency Data Exchange Language (EDXL),,http://docs.oasis-open.org/emergency/edxl-de/,Index of markup language.,High level inventory Pivot Viewer,Interchange Format,,Published Standard,ExtremeEvents,Organization for the Advancement of Structured Information Standards,,,,,,,,,,Emergency Data Exchange Language (EDXL),globe.jpg,http://docs.oasis-open.org/emergency/edxl-de/
Emissions Vocabulary,,http://vocab.deri.ie/emissions,(enhance)Emissions Vocabulary,NotDocumented,Vocabulary,information exchange,Unknown,Various,Digital Enterprise Research Institute,,,,,,,,,,Emissions Vocabulary,vocabulary.jpg,http://vocab.deri.ie/emissions
Entity-Action vocabulary,,http://vocab.deri.ie/entity-action,Allows to map entities to actions that can be performed on them.,NotDocumented,Vocabulary,information exchange,Unknown,Various,Digital Enterprise Research Institute,,,,,,,,,,Entity-Action vocabulary,vocabulary.jpg,http://vocab.deri.ie/entity-action
Environmental Change Network (ECN) Data Centre,,http://data.ecn.ac.uk/,"Access to publications. Keyword, site, and measurement searches featured. Core data can be requested through a form. The ECN Data Centre manages data for five UK integrated environmental monitoring networks: The UK Environmental Change Network The UK Environmental Change Biodiversity Network The Upland Waters Monitoring Network The UK Lake Ecological Observatory Network Electrical Supply Industry Network Together these networks cover 137 sites where a variety of physical, chemical and biological measurements are made, using a variety of data collection methods -- from field sampling to automated telemetry. The ECN Data Centre also works with: The Environmental Information Data Centre LTER-Europe The International Long-term Ecological Research Network (ILTER) ALTERNet",NotDocumented,Repository,,Community-Established,BiologicalSpeciesEcology,Centre for Ecology and Hydrology,,,,,,,,,,Environmental Change Network (ECN) Data Centre,database.jpg,http://data.ecn.ac.uk/
Environmental Electronic Exchange Language,,https://joinup.ec.europa.eu/catalogue/asset_release/environmental-electronic-exchange-language,Environmental Electronic Exchange Language (E3L) is a standard developed by the Autonomous Communities of Spain to facilitate the transmission and exchange of environmental information between the different public and private entities involved in the project.,NotDocumented,Specification,,Unknown,Environmental science,Join Up -- European Union Interoperability Solutions for Public Administrations (ISA) Programme.,,,,,,,,,,Environmental Electronic Exchange Language,globe.jpg,https://joinup.ec.europa.eu/catalogue/asset_release/environmental-electronic-exchange-language
ENVO ontology,,http://www.jbiomedsem.com/content/4/1/43 ; http://environmentontology.org/,"EnvO is a community ontology for the concise, controlled description of environments. a community-led, open project which seeks to provide an ontology for specifying a wide range of environments relevant to multiple life science disciplines and, through an open participation model, to accommodate the terminological requirements of all those needing to annotate data using ontology classes. This paper summarises ENVOÃ¢â‚¬â„¢s motivation, content, structure, adoption, and governance approach. The ontology is available from http://purl.obolibrary.org/obo/envo.owl webcite - an OBO format version is also available by switching the file suffix to Ã¢â‚¬Å“oboÃ¢â‚¬ï¿½.",Original CIComponent Compilation,Information Model,information exchange,Operational,,community,,,,,,,,,,ENVO ontology,informationModel.jpg,http://www.jbiomedsem.com/content/4/1/43 ; http://environmentontology.org/
EO vocabulary,GEOSS,,There doesn't seem to be an actual artefact.,Original CIComponent Compilation,Vocabulary,information exchange,Conceptual,,GEOSS,"OGC AIP-7 Architecture report, Figure 7",,,,,,,,,EO vocabulary,vocabulary.jpg,
EOSDIS User Registration System (URS),EOSDIS,https://urs.earthdata.nasa.gov/,The EOSDIS URS provides a centralized and simplified mechanism for user registration and profile management for all EOSDIS system components. End users may register and edit their profile information in one location allowing them access to the wide array of EOSDIS data and services. The EOSDIS URS also helps the EOSDIS program better understand the user demographics and access patterns in support of planning for new value-added features and customized services that can be directed to specific users or user groups resulting in better user experience.,Original CIComponent Compilation,Web site,user management,Operational,,NASA GCMD,,,,,,,,,,EOSDIS User Registration System (URS),globe.jpg,https://urs.earthdata.nasa.gov/
ErdDAP,,http://coastwatch.pfeg.noaa.gov/erddap/index.html,"ERDDAP is a data server that gives you a simple, consistent way to download subsets of gridded and tabular scientific datasets in common file formats and make graphs and maps. A Java based OpenDAP server that provides a rich frontend for registration, access and transformation of datasets. Does not actually cache any dataset. Configured via an XML file.",Original CIComponent Compilation,Server application,data presentation,Operational,,NOAA,,,,,,,,,,ErdDAP,webclient.jpg,http://coastwatch.pfeg.noaa.gov/erddap/index.html
ErdDAP API,,http://coastwatch.pfeg.noaa.gov/erddap/rest.html,"For every ERDDAP feature that you as a human with a browser can use, there is an almost identical feature that is designed to be easy for computer programs to use",Original CIComponent Compilation,API,data presentation,Operational,,NOAA,,,,,,,,,,ErdDAP API,webclient.jpg,http://coastwatch.pfeg.noaa.gov/erddap/rest.html
ESGF P2P,Earth System Grid Federation (ESGF),http://esgf.org/; https://github.com/ESGF,"ESGF P2P is a component architecture expressly designed to handle large-scale data management for worldwide distribution. The team of computer scientists and climate scientists has developed an operational system for serving climate data from multiple locations and sources. Model simulations, satellite observations, and reanalysis products are all being served from the ESGF P2P distributed data archive.",Original CIComponent Compilation,Platform,system,Operational,,"Department of Energy (DOE), co-funded by NASA, NOAA, NSF,  Max Planck Institute for Meteorology (MPI-M) German Climate Computing Centre (DKRZ), the Australian National University (ANU) National Computational Infrastructure (NCI), British Atmospheric Data Center (BADC).",,,,,,,,"THREDDS, PostGres, OpenID, X509, GridFTP server,  SOLR, OpenDAP, CentOS/RedHat",,ESGF P2P,globe.jpg,http://esgf.org/; https://github.com/ESGF
